ID,language,date,title,abstract,description,source,crs,lowerCorner,upperCorner,link,download,thumbnail,large_thumbnail,protocol,subject
"5e5147d5-6789-4d40-8f5a-0953b48c3661","eng","2013-02-14","Economic sensitivity (ESPON Climate project)","","Combined sensitivity to climate change of agriculture, forestry, summer and winter tourism, energy supply and demand. Regional sensitivities calculated on the basis of most recent statistical data.","Combined sensitivity to climate change of agriculture, forestry, summer and winter tourism, energy supply and demand. Regional sensitivities calculated on the basis of most recent statistical data.","urn:ogc:def:crs:EPSG:6.6:4326","","","","","","","OGC:WMS-1.1.1-http-get-map",Atmospheric conditions,climatologyMeteorologyAtmosphere]
"bd7d802f-f08d-4430-b514-362e8c443a6f","eng","2013-04-23T17:38:04","WISE GWB provisional dataset for horizon 5 - PUBLIC VERSION, Oct. 2012","","The shape file GWB_horizon_h5 comprises five GWBs situated in the French and Italian groundwater body horizon 5, which are usually underlying the groundwater bodies assigned to horizon 4. 			 The dbf tables of the shape files include the columns “EU_CD_GW” as the GWB identifier and “Horizon” describing the vertical positioning. The polygon identifier “Polygon_ID” was added subsequently, because some GWBs consist of several polygons with identical “EU_CD_GW”even in the same horizon. Some further GWB characteristics are provided with the Microsoft Excel file “GWB_attributes_2012June.xls” including the column “EU_CD_GW”, which serves as a key for joining spatial and attribute data. There is no corresponding spatial data for GWBs in the Microsoft Excel table without an entry in column “EU_CD_GW”.  The spatial resolution is given for about a half of the GWBs in the column “Scale” of the xls file, which is varying between the MS from 1:10,000 to 1:1,000,000 and mostly in the range from 1:50,000 to 1:250,000.","All GWBs assigned to horizon 5 are aggregated in the shape GWB_horizon_h5 regardless the structure of shape files submitted by the MS with affiliation to horizons, River Basin Districts or both. The attribute table includes the fields “EU_CD_GW”, “Horizon” and the artificial polygon identifier “Polygon_ID”. The linking between the shape file and the Microsoft Excel table GWB_attributes_2012June.xls, which comprises further attributes, has to be carried out using column EU_CD_GW as key for joining the dbf table of the shape file with the xls file.","urn:ogc:def:crs:OGP Surveying & Positioning Committee::urn:ogc:def:crs:EPSG:7.1:4258","","","http://www.eea.europa.eu/data-and-maps/data/ds_resolveuid/28ab5e4028384e1484b6211d97c0f01d","","","","",Hydrography,Area management/restriction/regulation zones and reporting units,groundwater,aquifer,inlandWaters]
"120e83fd-1da7-407c-ad3a-935021d9711d","eng","2015-01-08T12:34:38","EUNIS habitat type G2.6 distribution based on vegetation plot data - version 1, Jan. 2015","","The verified habitat samples used are derived from the Braun-Blanquet database (http://www.sci.muni.cz/botany/vegsci/braun_blanquet.php?lang=en) which is a centralised database of vegetation plots and comprises copies of national and regional databases using a unified taxonomic reference database.","The database compiled for the Braun-Blanquet project comprises various national and regional vegetation databases. The maintenance of these databases is in principle in the hands of the custodians. However, before uploading datasets into the Braun-Blanquet database a quality check is performed by Alterra and Masaryk University. If possible, detected errors are corrected and reported back to the data provider. Attributes added to the distribution data are: PLOTSOBSID (reference to the PlotObservationID in the database 'European Vegetation Data (2014 EUNIS forests).db') and PRECISION_M (precision in meters, indicating how precise the location is indicated).","urn:ogc:def:crs:OGP Surveying & Positioning Committee::urn:ogc:def:crs:EPSG:7.1:3035","","","http://www.eea.europa.eu/data-and-maps/data/ds_resolveuid/97bc44abffd54e12998008c57209e0eb","","","","",Habitats and biotopes,forest,natural area,terrestrial ecosystem,Europe,biota]
"f766707a-0118-4975-81ca-1fe4f66f2679","eng","2015-01-08T12:34:38","EUNIS habitat type G1.2 distribution based on vegetation plot data - version 1, Jan. 2015","","The verified habitat samples used are derived from the Braun-Blanquet database (http://www.sci.muni.cz/botany/vegsci/braun_blanquet.php?lang=en) which is a centralised database of vegetation plots and comprises copies of national and regional databases using a unified taxonomic reference database.","The database compiled for the Braun-Blanquet project comprises various national and regional vegetation databases. The maintenance of these databases is in principle in the hands of the custodians. However, before uploading datasets into the Braun-Blanquet database a quality check is performed by Alterra and Masaryk University. If possible, detected errors are corrected and reported back to the data provider. Attributes added to the distribution data are: PLOTSOBSID (reference to the PlotObservationID in the database 'European Vegetation Data (2014 EUNIS forests).db') and PRECISION_M (precision in meters, indicating how precise the location is indicated).","urn:ogc:def:crs:OGP Surveying & Positioning Committee::urn:ogc:def:crs:EPSG:7.1:3035","","","http://www.eea.europa.eu/data-and-maps/data/ds_resolveuid/97bc44abffd54e12998008c57209e0eb","","","","",Habitats and biotopes,forest,natural area,terrestrial ecosystem,Europe,biota]
"53ca956f-fefa-4c60-807c-8b6c6d4e5a0df","eng","2012-01-10T14:34:38","EEA reference grid for Czech Republic (10km), May 2013","","The grid is based on proposal at the 1st European Workshop on Reference Grids in 2003 and later INSPIRE geographical grid systems. The sample grid available here is part of a set of three polygon grids in 1, 10 and 100 kilometres. The grids cover at least country borders and, where applicable, marine Exclusive Economic Zones v7.0, http://www.marineregions.org. Note that the extent of the grid into the marine area does not reflect the extent of the territorial waters.","The reference grids are based on ETRS89 Lambert Azimuthal Equal Area projection with parameters: latitude of origin 52°N, longitude of origin 10°E, false northing 3210000.0m, false easting 4321000.0m. Origin of the grid is calculated from 0mN 0mE of projection. The method followed the instructions for the EEA fishnet tool described in the EEA GIS guideline available from http://www.eionet.europa.eu/gis. All grids have been created using one of the two scripts available in the scripts subfolder located in the data directory. Their usage is documented in the readme.txt file available in the same subfolder.","urn:ogc:def:crs:OGP Surveying & Positioning Committee::urn:ogc:def:crs:EPSG:7.1:3035","","","http://www.eea.europa.eu/data-and-maps/data/eea-reference-grids-2","","","","",Geographical grid systems,location]
"2d8fc6d2-c551-4d2d-99f3-93c1f3099dcff","eng","2012-01-10T14:34:53","EEA reference grid for Canary Islands (1km), May 2013","","The grid is based on proposal at the 1st European Workshop on Reference Grids in 2003 and later INSPIRE geographical grid systems. The sample grid available here is part of a set of three polygon grids in 1, 10 and 100 kilometres. The grids cover at least country borders and, where applicable, marine Exclusive Economic Zones v7.0, http://www.marineregions.org. Note that the extent of the grid into the marine area does not reflect the extent of the territorial waters.","The reference grids are based on ETRS89 Lambert Azimuthal Equal Area projection with parameters: latitude of origin 52°N, longitude of origin 10°E, false northing 3210000.0m, false easting 4321000.0m. Origin of the grid is calculated from 0mN 0mE of projection. The method followed the instructions for the EEA fishnet tool described in the EEA GIS guideline available from http://www.eionet.europa.eu/gis. All grids have been created using one of the two scripts available in the scripts subfolder located in the data directory. Their usage is documented in the readme.txt file available in the same subfolder.","urn:ogc:def:crs:OGP Surveying & Positioning Committee::urn:ogc:def:crs:EPSG:7.1:3035","","","http://www.eea.europa.eu/data-and-maps/data/eea-reference-grids-2","","","","",Geographical grid systems,location]
"0e7dbc26-c031-4006-b19b-7d0e4e2d4ca8","eng","2012-01-23T13:27:13","Urban Atlas - Sweden - Gothenburg (Göteborg)","","The Urban Atlas is providing pan-European comparable land use and land cover data for Large Urban Zones with more than 100.000 inhabitants as defined by the Urban Audit. Urban Atlas' mission is to provide high-resolution hotspot mapping of changes in urban spaces and indicators for users such as city governments, the European Environment Agency (EEA) and European Commission departments.","Earth Observation (EO) Data used:                       * Spot 5 2,50 m - 50492311004111047262B0 (PS) (Date: 2010/04/11)                        * Spot 5 2,50 m - 50492320909061017272B0 (PS) (Date: 2009/09/06)                        * Spot 5 2,50 m - 50502310910171029452B0 (PS) (Date: 2009/10/17)                        * Spot 5 2,50 m - 50502320906231058092B0 (PS) (Date: 2009/06/23)                        * Spot 5 2,50 m - 50502330906231058172B0 (PS) (Date: 2009/06/23)","urn:ogc:def:crs:OGP Surveying & Positioning Committee::urn:ogc:def:crs:EPSG:7.1:32633","","","http://www.eea.europa.eu/data-and-maps/data/ds_resolveuid/9df69b925454fd267512ea65898dbbdc","","","","",Land use,urban area,land use,Sweden,Gothenburg,society]
"23b457d3-2c09-47b5-bbee-ba976b2c8c63","eng","2012-01-10T14:35:53","EEA reference grid for Bulgaria (10km), May 2011","","The grid is based on proposal at the 1st European Workshop on Reference Grids in 2003 and later INSPIRE geographical grid systems. The sample grid available here is part of a set of three polygon grids in 1, 10 and 100 kilometres. The grids cover at least country borders and, where applicable, marine Exclusive Economic Zones v2.0, http://www.vliz.be/vmdcdata/marbound. Note that the extent of the grid into the marine area does not reflect the extent of the territorial waters.","The reference grids are based on ETRS89 Lambert Azimuthal Equal Area projection with parameters: latitude of origin 52°N, longitude of origin 10°E, false northing 3210000.0m, false easting 4321000.0m. Origin of the grid is calculated from 0mN 0mE of projection. The method followed the instructions for the EEA fishnet tool described in the EEA GIS guideline available from http://www.eionet.europa.eu/gis.","urn:ogc:def:crs:OGP Surveying & Positioning Committee::urn:ogc:def:crs:EPSG:7.1:3035","","","http://www.eea.europa.eu/data-and-maps/data/ds_resolveuid/035b0873a523d5003396e1a02c405361","","","","",Geographical grid systems,location,geoscientificInformation]
"34b3126f-0884-4741-aecd-01b2da851793","eng","2012-01-10T14:35:51","EEA reference grid for Norway (1km), May 2011","","The grid is based on proposal at the 1st European Workshop on Reference Grids in 2003 and later INSPIRE geographical grid systems. The sample grid available here is part of a set of three polygon grids in 1, 10 and 100 kilometres. The grids cover at least country borders and, where applicable, marine Exclusive Economic Zones v2.0, http://www.vliz.be/vmdcdata/marbound. Note that the extent of the grid into the marine area does not reflect the extent of the territorial waters.","The reference grids are based on ETRS89 Lambert Azimuthal Equal Area projection with parameters: latitude of origin 52°N, longitude of origin 10°E, false northing 3210000.0m, false easting 4321000.0m. Origin of the grid is calculated from 0mN 0mE of projection. The method followed the instructions for the EEA fishnet tool described in the EEA GIS guideline available from http://www.eionet.europa.eu/gis.","urn:ogc:def:crs:OGP Surveying & Positioning Committee::urn:ogc:def:crs:EPSG:7.1:3035","","","http://www.eea.europa.eu/data-and-maps/data/ds_resolveuid/035b0873a523d5003396e1a02c405361","","","","",Geographical grid systems,location,geoscientificInformation]
"717b42bc-2302-404d-b9c5-6efabf711dd5","eng","2013-02-14","Potential physical impact (ESPON Climate project)","","Combined potential impacts of change in inundation depths of a 100 year river flood and a sea level rise adjusted 100 year coastal storm event as well as changes in flash flood potential and summer heat on population. Impact calculated as combination of regional exposure to climatic changes and recent data on regional sensitivity. Climatic changes derived from a comparison of 1961-1990 and 2071-2100 climate projections by the CCLM model for the IPCC SRES A1B scenario. Fluvial inundation depths changes based on LISFLOOD projections. Regional coastal storm surge heights projected by DIVA model were adjusted with 1 m sea level rise.","Impact calculated as combination of regional exposure to climatic changes and recent data on regional sensitivity. Climatic changes derived from a comparison of 1961-1990 and 2071-2100 climate projections by the CCLM model for the IPCC SRES A1B scenario. Fluvial inundation depths changes based on LISFLOOD projections. Regional coastal storm surge heights projected by DIVA model were adjusted with 1 m sea level rise.","urn:ogc:def:crs:EPSG:6.6:4326","","","","","","","OGC:WMS-1.1.1-http-get-map",inundation depth,river flood,sea level rise,coastal storm,Atmospheric conditions,climatologyMeteorologyAtmosphere]
"54d4ff10-a02a-4090-b063-f8ab3c96ebb0","eng","2015-07-30T16:09:48","EUNIS habitat type G3.9b, predicted distribution of habitat suitability - version 1, Jan. 2015","","The modelled suitability for the EUNIS habitat type is an indication of where conditions are favourable for the habitat type based on sample plot data (Braun-Blanquet database) and the Maxent software package. The modelled suitability map may be used as a proxy for the geographical distribution of the habitat type. Note however that it is not representing the actual distribution of the habitat type.","The database compiled for the Braun-Blanquet project is a compilation of various national and regional vegetation databases. The maintenance of these databases is in principle in the hands of the custodians. However, before uploading the databases into Braun-Blanquet database a quality check is performed by Alterra and Masaryk University. If possible, detected errors are corrected and reported back to the data provider. For the modelling of the habitat suitability map the Maxent software is used (http://www.cs.princeton.edu/~schapire/maxent/). The grid values in the map represent the probability (ranging from 0-1) that the cell is suitable for the habitat. The grid file represents the habitat suitability of the EUNIS type. For the modelling the widely used software Maxent for maximum entropy modelling of species’ geographic distributions was used. Maxent is a general-purpose machine-learning method with a simple and precise mathematical formulation, and has a number of aspects that make it well-suited for species distribution modelling when only presence (occurrence) data but not absence data are available (Philips et al. 2006). Because EUNIS habitats have a particular species composition, they are assumed to respond to specific ecological requirements, allowing us to generate correlative estimates of geographic distributions. Modelling habitats that have been floristically defined is a well-known procedure for ecological modelling at local scales, and a promising technique to be applied also at the continental level.                  The Maxent method considers presence data (known observations of a given entity) and the so-called background data. Background data comprise a set of points used to describe the environmental variation of the study area according to the available environmental layers. It is assumed that these layers represent well the most important ecological gradients on a European scale. As layers the following environmental parameters have been used: Potential Evapotranspiration, Topsoil pH, Solar radiation, Temperature Seasonality (standard deviation *100), Mean Temperature of Wettest Quarter, Annual Precipitation, Precipitation Seasonality (Coefficient of Variation), Precipitation of Warmest Quarter & Distance to water (rivers, lakes, sea). Statistical output of the model: #Training samples: 551 Regularized training gain: 1.6047 Unregularized training gain: 1.779 Iterations: 500 Training AUC: 0.938 #Test samples: 61 Test gain: 1.5894 Test AUC: 0.9235 AUC Standard Deviation: 0.0074 #Background points: 10274 bio_12_etrs2_ras contribution: 1.7246 bio_15_etrs2_ras contribution: 4.5698 bio_18_etrs2_ras contribution: 59.8598 bio_4_etrs2_ras contribution: 3.0765 bio_8_etrs2_ras contribution: 6.6394 dist2water1km contribution: 4.6239 pet_he_yr contribution: 12.6501 soil_ph contribution: 4.9473 solar_1km contribution: 1.9085 bio_12_etrs2_ras permutation importance: 4.663 bio_15_etrs2_ras permutation importance: 7.0067 bio_18_etrs2_ras permutation importance: 68.5827 bio_4_etrs2_ras permutation importance: 2.3029 bio_8_etrs2_ras permutation importance: 5.5913 dist2water1km permutation importance: 2.5289 pet_he_yr permutation importance: 5.7074 soil_ph permutation importance: 2.2444 solar_1km permutation importance: 1.3729 Training gain without bio_12_etrs2_ras: 1.5757 Training gain without bio_15_etrs2_ras: 1.5485 Training gain without bio_18_etrs2_ras: 1.5242 Training gain without bio_4_etrs2_ras: 1.5871 Training gain without bio_8_etrs2_ras: 1.591 Training gain without dist2water1km: 1.5506 Training gain without pet_he_yr: 1.5634 Training gain without soil_ph: 1.5682 Training gain without solar_1km: 1.587 Training gain with only bio_12_etrs2_ras: 0.2283 Training gain with only bio_15_etrs2_ras: 0.3311 Training gain with only bio_18_etrs2_ras: 1.1116 Training gain with only bio_4_etrs2_ras: 0.3341 Training gain with only bio_8_etrs2_ras: 0.5807 Training gain with only dist2water1km: 0.271 Training gain with only pet_he_yr: 0.7354 Training gain with only soil_ph: 0.4561 Training gain with only solar_1km: 0.065 Test gain without bio_12_etrs2_ras: 1.5697 Test gain without bio_15_etrs2_ras: 1.5186 Test gain without bio_18_etrs2_ras: 1.527 Test gain without bio_4_etrs2_ras: 1.5532 Test gain without bio_8_etrs2_ras: 1.5712 Test gain without dist2water1km: 1.5316 Test gain without pet_he_yr: 1.5343 Test gain without soil_ph: 1.5744 Test gain without solar_1km: 1.6178 Test gain with only bio_12_etrs2_ras: 0.3124 Test gain with only bio_15_etrs2_ras: 0.3377 Test gain with only bio_18_etrs2_ras: 1.2686 Test gain with only bio_4_etrs2_ras: 0.4335 Test gain with only bio_8_etrs2_ras: 0.4994 Test gain with only dist2water1km: 0.2666 Test gain with only pet_he_yr: 0.8347 Test gain with only soil_ph: 0.3684 Test gain with only solar_1km: 0.0587 AUC without bio_12_etrs2_ras: 0.9222 AUC without bio_15_etrs2_ras: 0.9186 AUC without bio_18_etrs2_ras: 0.9182 AUC without bio_4_etrs2_ras: 0.9202 AUC without bio_8_etrs2_ras: 0.922 AUC without dist2water1km: 0.9177 AUC without pet_he_yr: 0.9196 AUC without soil_ph: 0.9236 AUC without solar_1km: 0.9265 AUC with only bio_12_etrs2_ras: 0.7167 AUC with only bio_15_etrs2_ras: 0.7104 AUC with only bio_18_etrs2_ras: 0.8877 AUC with only bio_4_etrs2_ras: 0.7548 AUC with only bio_8_etrs2_ras: 0.748 AUC with only dist2water1km: 0.6277 AUC with only pet_he_yr: 0.8383 AUC with only soil_ph: 0.7267 AUC with only solar_1km: 0.5968 Entropy: 7.6441 Prevalence (average of logistic output over background sites): 0.0991 Fixed cumulative value 1 cumulative threshold: 1 Fixed cumulative value 1 logistic threshold: 0.02 Fixed cumulative value 1 area: 0.3258 Fixed cumulative value 1 training omission: 0.0018 Fixed cumulative value 1 test omission: 0 Fixed cumulative value 1 binomial probability: 1.36E-29 Fixed cumulative value 5 cumulative threshold: 5 Fixed cumulative value 5 logistic threshold: 0.1642 Fixed cumulative value 5 area: 0.2104 Fixed cumulative value 5 training omission: 0.0236 Fixed cumulative value 5 test omission: 0.0164 Fixed cumulative value 5 binomial probability: 5.90E-50 Fixed cumulative value 10 cumulative threshold: 10 Fixed cumulative value 10 logistic threshold: 0.2704 Fixed cumulative value 10 area: 0.1737 Fixed cumulative value 10 training omission: 0.0472 Fixed cumulative value 10 test omission: 0.0328 Fixed cumulative value 10 binomial probability: 1.96E-60 Minimum training presence cumulative threshold: 0.0336 Minimum training presence logistic threshold: 0.0006 Minimum training presence area: 0.6798 Minimum training presence training omission: 0 Minimum training presence test omission: 0 Minimum training presence binomial probability: 4.15E-08 10 percentile training presence cumulative threshold: 15.8236 10 percentile training presence logistic threshold: 0.3356 10 percentile training presence area: 0.147 10 percentile training presence training omission: 0.098 10 percentile training presence test omission: 0.1311 10 percentile training presence binomial probability: 2.19E-57 Equal training sensitivity and specificity cumulative threshold: 20.1452 Equal training sensitivity and specificity logistic threshold: 0.3631 Equal training sensitivity and specificity area: 0.1307 Equal training sensitivity and specificity training omission: 0.1307 Equal training sensitivity and specificity test omission: 0.2131 Equal training sensitivity and specificity binomial probability: 1.69E-52 Maximum training sensitivity plus specificity cumulative threshold: 10.3567 Maximum training sensitivity plus specificity logistic threshold: 0.2792 Maximum training sensitivity plus specificity area: 0.1718 Maximum training sensitivity plus specificity training omission: 0.0472 Maximum training sensitivity plus specificity test omission: 0.0492 Maximum training sensitivity plus specificity binomial probability: 7.80E-59 Equal test sensitivity and specificity cumulative threshold: 16.6824 Equal test sensitivity and specificity logistic threshold: 0.3426 Equal test sensitivity and specificity area: 0.1437 Equal test sensitivity and specificity training omission: 0.1125 Equal test sensitivity and specificity test omission: 0.1475 Equal test sensitivity and specificity binomial probability: 2.04E-56 Maximum test sensitivity plus specificity cumulative threshold: 7.834 Maximum test sensitivity plus specificity logistic threshold: 0.23 Maximum test sensitivity plus specificity area: 0.1869 Maximum test sensitivity plus specificity training omission: 0.0381 Maximum test sensitivity plus specificity test omission: 0.0164 Maximum test sensitivity plus specificity binomial probability: 1.16E-57 Balance training omission, predicted area and threshold value cumulative threshold: 2.1949 Balance training omission, predicted area and threshold value logistic threshold: 0.0642 Balance training omission, predicted area and threshold value area: 0.2575 Balance training omission, predicted area and threshold value training omission: 0.0018 Balance training omission, predicted area and threshold value test omission: 0 Balance training omission, predicted area and threshold value binomial probability: 1.95E-40 Equate entropy of thresholded and original distributions cumulative threshold: 5.7446 Equate entropy of thresholded and original distributions logistic threshold: 0.1792 Equate entropy of thresholded and original distributions area: 0.2032 Equate entropy of thresholded and original distributions training omission: 0.0236 Equate entropy of thresholded and original distributions test omission: 0.0164 Equate entropy of thresholded and original distributions binomial probability: 4.01E-52","urn:ogc:def:crs:OGP Surveying & Positioning Committee::urn:ogc:def:crs:EPSG:7.1:3035","","","http://www.eea.europa.eu/data-and-maps/data/ds_resolveuid/97bc44abffd54e12998008c57209e0eb","","","","",Habitats and biotopes,forest,natural area,terrestrial ecosystem,Europe,biota]
