ID,language,date,title,abstract,description,source,crs,lowerCorner,upperCorner,link,download,thumbnail,large_thumbnail,protocol,subject
"5dd30888-595e-45a1-acb7-017f99b69988","eng","2012-01-23T13:27:13","Urban Atlas - United Kingdom - Aberdeen","","The Urban Atlas is providing pan-European comparable land use and land cover data for Large Urban Zones with more than 100.000 inhabitants as defined by the Urban Audit. Urban Atlas' mission is to provide high-resolution hotspot mapping of changes in urban spaces and indicators for users such as city governments, the European Environment Agency (EEA) and European Commission departments.","Earth Observation (EO) Data used:                       * Spot 5 2,50 m - 50182320906251200412B0 (Date: 2009/06/25)                        * Spot 5 2,50 m - 50182330906251200472B0 (Date: 2009/06/25)                        * Spot 5 2,50 m - 50212320910291140132B0 (Date: 2009/10/29)                        * Spot 5 2,50 m - 50212330911091128572B0 (Date: 2009/11/09)                        * Spot 5 2,50 m - 50212340911091129062B0 (Date: 2009/11/09)                        * RapidEye 5 m - 2009-05-12T121414_RE2_3A-NAC_5648225_105467 (Date: 2009/05/12)                        * RapidEye 5 m - 2009-05-12T121415_RE2_3A-NAC_5647942_105467 (Date: 2009/05/12)                        * RapidEye 5 m - 2009-05-12T121415_RE2_3A-NAC_5648118_105467 (Date: 2009/05/12)                        * RapidEye 5 m - 2009-05-12T121416_RE2_3A-NAC_5647939_105467 (Date: 2009/05/12)                        * RapidEye 5 m - 2009-05-12T121417_RE2_3A-NAC_5648342_105467 (Date: 2009/05/12)                        * RapidEye 5 m - 2009-05-12T121417_RE2_3A-NAC_5647781_105467 (Date: 2009/05/12)                        * RapidEye 5 m - 2009-05-12T121419_RE2_3A-NAC_5647894_105467 (Date: 2009/05/12)                        * RapidEye 5 m - 2009-05-12T121420_RE2_3A-NAC_5648224_105467 (Date: 2009/05/12)                        * RapidEye 5 m - 2009-05-12T121421_RE2_3A-NAC_5648418_105467 (Date: 2009/05/12)                        * RapidEye 5 m - 2009-05-17T121901_RE2_3A-NAC_5648421_105467 (Date: 2009/05/17)                        * RapidEye 5 m - 2009-05-17T121911_RE2_3A-NAC_5648420_105467 (Date: 2009/05/17)                        * RapidEye 5 m - 2009-05-30T121219_RE1_3A-NAC_5648123_105467 (Date: 2009/05/30)                        * RapidEye 5 m - 2009-05-30T121222_RE1_3A-NAC_5648114_105467 (Date: 2009/05/30)                        * RapidEye 5 m - 2009-05-30T121223_RE1_3A-NAC_5648341_105467 (Date: 2009/05/30)                        * RapidEye 5 m - 2009-06-25T121606_RE3_3A-NAC_5648223_105467 (Date: 2009/06/25)                        * RapidEye 5 m - 2009-06-25T121610_RE3_3A-NAC_5648122_105467 (Date: 2009/06/25)                        * RapidEye 5 m - 2009-06-25T121611_RE3_3A-NAC_5648117_105467 (Date: 2009/06/25)                        * RapidEye 5 m - 2009-06-25T121613_RE3_3A-NAC_5647940_105467 (Date: 2009/06/25)                        * RapidEye 5 m - 2009-06-25T121614_RE3_3A-NAC_5648228_105467 (Date: 2009/06/25)                        * RapidEye 5 m - 2009-06-25T121617_RE3_3A-NAC_5648121_105467 (Date: 2009/06/25)                        * RapidEye 5 m - 2009-06-25T121618_RE3_3A-NAC_5647941_105467 (Date: 2009/06/25)                        * RapidEye 5 m - 2009-06-25T121621_RE3_3A-NAC_5648222_105467 (Date: 2009/06/25)                        * RapidEye 5 m - 2009-06-25T121622_RE3_3A-NAC_5647936_105467 (Date: 2009/06/25)                        * RapidEye 5 m - 2009-09-12T121611_RE1_3A-NAC_5648232_105467 (Date: 2009/09/12)                        * RapidEye 5 m - 2009-09-12T121612_RE1_3A-NAC_5648231_105467 (Date: 2009/09/12)                        * RapidEye 5 m - 2009-09-12T121613_RE1_3A-NAC_5648119_105467 (Date: 2009/09/12)                        * RapidEye 5 m - 2009-09-12T121613_RE1_3A-NAC_5648115_105467 (Date: 2009/09/12)                        * RapidEye 5 m - 2009-09-12T121614_RE1_3A-NAC_5648116_105467 (Date: 2009/09/12)                        * RapidEye 5 m - 2009-09-12T121615_RE1_3A-NAC_5648343_105467 (Date: 2009/09/12)                        * RapidEye 5 m - 2009-09-12T121616_RE1_3A-NAC_5648419_105467 (Date: 2009/09/12)                        * RapidEye 5 m - 2009-10-16T121002_RE2_3A-NAC_5648120_105467 (Date: 2009/10/16)","urn:ogc:def:crs:OGP Surveying & Positioning Committee::urn:ogc:def:crs:EPSG:7.1:32630","","","http://www.eea.europa.eu/data-and-maps/data/ds_resolveuid/9df69b925454fd267512ea65898dbbdc","","","","",Land use,urban area,land use,United Kingdom,Aberdeen,society]
"5ac1edb6-0d64-40cc-af26-44f85b10123a","eng","2014-03-20T19:36:25","Corine Land Cover 2000 - 2006 changes, consumption code in changed areas (raster 100m) - version 16, Apr. 2012","","With the help of CLC data it is possible to provide support for protecting ecosystems, halting the loss of biological diversity, tracking the impacts of climate change, assessing developments in agriculture and implementing the EU Water Framework Directive. CLC data is an important data set for the implementation of key priority areas of the Sixth Environment Action Programme of the European Community. CLC data can show, for instance, where fragmentation of the landscape by roads and other infrastructure is worsening and thus increasing the risk that ecosystems can no longer connect with each other, putting the survival of their flora and fauna in danger. In the agricultural field CLC data can highlight where major structural changes are continuing or intensifying, such as the conversion of pasture to arable land, expansion or reduction in the area of fallow land and land taken out of production ('set aside'), or the abandonment of farming altogether. CLC serve as input to the EC 'Inspire' (INfrastructure for SPatial InfoRmation in Europe - http://inspire.jrc.it) initiative. This initiative intends to trigger the creation of a European spatial information infrastructure that delivers to the users integrated spatial information services. CLC programme is also a contribution to the Global Monitoring for Environment and Security (GMES http://gmes.info) initiative, run by the European Commission and the European Space Agency, to provide environmental information from a combination of air- and space-based observation systems and in-situ monitoring.","Input data: Corine Land Cover 2000 - 2006 changes (file geodatabase v10)  Rasterisation using gdal_rasterize from GDAL 1.9.0 command line utilities - Loop through the list of layers, and generate the layers as defined there, see the shell script [0] and the list of layers (layer_code.list) [1].  - Thereby translating the 3-digit CLC codes (111...999) into grid codes within the 8-bit  range (0...44), see clc_legend.csv [2] - And eventually adding the usual CLC colour table to the generated GeoTIFF, by using a pre-defined vrt file, see [3]  [0]: docs/rasterize.sh [1]: docs/layer_code.list [2]: docs/clc_legend.csv [3]: docs/legend_100.vrt","urn:ogc:def:crs:OGP Surveying & Positioning Committee::urn:ogc:def:crs:EPSG:7.1:3035","","","http://www.eea.europa.eu/data-and-maps/data/ds_resolveuid/ac3a9aae-8748-4176-9729-808852fd960e","","","","",Land cover,environment,geoscientificInformation]
"97435b77-4cbb-4aa8-a611-d8905b66483a","eng","2012-01-23T13:27:13","Urban Atlas - United Kingdom - Glasgow","","The Urban Atlas is providing pan-European comparable land use and land cover data for Large Urban Zones with more than 100.000 inhabitants as defined by the Urban Audit. Urban Atlas' mission is to provide high-resolution hotspot mapping of changes in urban spaces and indicators for users such as city governments, the European Environment Agency (EEA) and European Commission departments.","Earth Observation (EO) Data used:                       * Spot 5 2,50 m - 50182361009261159112B0 (PS) (Date: 2010/09/26)                        * Spot 5 2,50 m - 50212360911081148352B0 (PS) (Date: 2009/11/08)                        * Spot 5 2,50 m - 50212370911081148442B0 (PS) (Date: 2009/11/08)                        * RapidEye 5 m - 2009-05-30T121236_RE1_3A-NAC_5649383_105639 (XS) (Date: 2009/05/30)                        * RapidEye 5 m - 2009-05-30T121237_RE1_3A -NAC_5649421_105639 (XS) (Date: 2009/05/30)                        * RapidEye 5 m - 2009-05-30T121240_RE1_3A -NAC_5649262_105639 (XS) (Date: 2009/05/30)                        * RapidEye 5 m - 2009-05-30T121241_RE1_3A -NAC_5649260_105639 (XS) (Date: 2009/05/30)                        * RapidEye 5 m - 2009-05-30T121242_RE1_3A -NAC_5649520_105639 (XS) (Date: 2009/05/30)                        * RapidEye 5 m - 2009-05-30T121244_RE1_3A -NAC_5649263_105639 (XS) (Date: 2009/05/30)                        * RapidEye 5 m - 2009-06-29T122216_RE2_3A -NAC_5650404_105639 (XS) (Date: 2009/06/29)                        * RapidEye 5 m - 2009-08-22T121338_RE4_3A -NAC_5650333_105639 (XS) (Date: 2009/08/22)                        * RapidEye 5 m - 2009-08-22T121342_RE4_3A -NAC_5650331_105639 (XS) (Date: 2009/08/22)                        * RapidEye 5 m - 2009-08-22T121345_RE4_3A -NAC_5650330_105639 (XS) (Date: 2009/08/22)                        * RapidEye 5 m - 2009-08-22T121345_RE4_3A -NAC_5650332_105639 (XS) (Date: 2009/08/22)                        * RapidEye 5 m - 2009-09-12T121637_RE1_3A -NAC_5649384_105639 (XS) (Date: 2009/09/12)                        * RapidEye 5 m - 2009-09-12T121638_RE1_3A -NAC_5649522_105639 (XS) (Date: 2009/09/12)                        * RapidEye 5 m - 2009-10-16T121016_RE2_3A -NAC_5649420_105639 (XS) (Date: 2009/10/16)                        * RapidEye 5 m - 2009-10-16T121016_RE2_3A -NAC_5649349_105639 (XS) (Date: 2009/10/16)                        * RapidEye 5 m - 2009-10-16T121019_RE2_3A -NAC_5649519_105639 (XS) (Date: 2009/10/16)                        * RapidEye 5 m - 2009-10-16T121020_RE2_3A -NAC_5649261_105639 (XS) (Date: 2009/10/16)                        * RapidEye 5 m - 2009-10-16T121023_RE2_3A -NAC_5649346_105639 (XS) (Date: 2009/10/16)                        * RapidEye 5 m - 2009-10-16T121026_RE2_3A -NAC_5649518_105639 (XS) (Date: 2009/10/16)                        * RapidEye 5 m - 2009-10-16T121027_RE2_3A -NAC_5649347_105639 (XS) (Date: 2009/10/16)","urn:ogc:def:crs:OGP Surveying & Positioning Committee::urn:ogc:def:crs:EPSG:7.1:32630","","","http://www.eea.europa.eu/data-and-maps/data/ds_resolveuid/9df69b925454fd267512ea65898dbbdc","","","","",Land use,urban area,land use,United Kingdom,Glasgow,society]
"fee1dd1a-b65b-4d01-9f54-00c080f9e151","eng","2013-05-03T18:23:40","Coastal zones derived from Corine Land Cover class 523 (raster 100m), Dec. 2011","","Coastal zones are presented as a series of 10 consecutive buffers of 1km width each (towards inland). For this dataset, were treated as sea data all areas with a class value of 523 (sea and ocean) in Corine Land Cover (details in lineage).","0. Download the CLC v.15 100 m raster datasets, as published in EEA data service:  Corine Land Cover 2000 raster data - version 15 (08/2011), Aug 24, 2011 Corine Land Cover 2006 raster data - version 15 (08/2011), Aug 24, 2011 Corine Land Cover 1990 raster data - version 15 (08/2011), Aug 24, 2011 Corine Land Cover 2000 - 2006 changes - version 15 (08/2011), Aug 24, 2011 Corine Land Cover 1990 - 2000 changes - version 15 (08/2011), Aug 24, 2011  http://www.eea.europa.eu/data-and-maps/data#c12=corine+version+15+raster+data    1. Generate layers FK90 and FK00 as described in LEAC_methodology_report_2011.pdf  In GRASS: r.mapcalc FK00 =  (cha06_00 != 990 ? cha06_00 : clc06 != 990 ? clc06 : clc00)  r.mapcalc FK90 =  (clc90 == 990 ? 990 : cha00_90 != 990 ? cha00_90 : FK00)    2. Generate the coastal zones in GRASS as buffers of the SEA areas, according to the attached buffer.sh script  Layer buffer_523_1_to_10km can be generated directly from the input layers clc06, FK00 and FK90.","urn:ogc:def:crs:OGP Surveying & Positioning Committee::urn:ogc:def:crs:EPSG:7.1:3035","","","","","","","",Elevation,environment,geoscientificInformation]
"6e63520a-598a-4051-ba52-a995d5080021","eng","2013-01-25T21:58:06","Cadmium (Cd) concentration in topsoils, Sep. 2007","","Maps of estimated total cadmium concentrations in soils using 1588 geo-referenced topsoil samples from the FOREGS Geochemical database. The concentrations were interpolated using block regression-kriging over the 26 European countries that contributed to the database.  			 			Heavy metal contents are expressed in mg kg-1. 			 			This metadata record is adapted from the orginal one received from JRC.","Refer to http://eusoils.jrc.ec.europa.eu/foregshmc/ and to Rodriguez Lado, L., Hengl, T., Reuter, H.I., (2008) Heavy metals in European soils: a geostatistical analysis of the FOREGS Geochemical database. Geoderma 148, 189-199.  [http://www.sciencedirect.com/science/article/pii/S0016706108002668].","urn:ogc:def:crs:OGP Surveying & Positioning Committee::urn:ogc:def:crs:EPSG:7.1:3035","","","http://eusoils.jrc.ec.europa.eu/library/esdac/Esdac_DetailData2.cfm?id=9","","","","",Soil,soil,cadmium,heavy metal,concentration,geoscientificInformation]
"a2d18e0e-be68-4a9a-ae29-371e8b4f7ac9","eng","2012-01-10T14:34:41","EEA reference grid for Croatia (100km), May 2011","","The grid is based on proposal at the 1st European Workshop on Reference Grids in 2003 and later INSPIRE geographical grid systems. The sample grid available here is part of a set of three polygon grids in 1, 10 and 100 kilometres. The grids cover at least country borders and, where applicable, marine Exclusive Economic Zones v2.0, http://www.vliz.be/vmdcdata/marbound. Note that the extent of the grid into the marine area does not reflect the extent of the territorial waters.","The reference grids are based on ETRS89 Lambert Azimuthal Equal Area projection with parameters: latitude of origin 52°N, longitude of origin 10°E, false northing 3210000.0m, false easting 4321000.0m. Origin of the grid is calculated from 0mN 0mE of projection. The method followed the instructions for the EEA fishnet tool described in the EEA GIS guideline available from http://www.eionet.europa.eu/gis.","urn:ogc:def:crs:OGP Surveying & Positioning Committee::urn:ogc:def:crs:EPSG:7.1:3035","","","http://www.eea.europa.eu/data-and-maps/data/ds_resolveuid/035b0873a523d5003396e1a02c405361","","","","",Geographical grid systems,location,geoscientificInformation]
"0e97fc9e-9a3f-4e3e-80a2-92cc49fd4cc0","eng","2012-01-10T14:34:37","EEA reference grid for Estonia (100km), May 2011","","The grid is based on proposal at the 1st European Workshop on Reference Grids in 2003 and later INSPIRE geographical grid systems. The sample grid available here is part of a set of three polygon grids in 1, 10 and 100 kilometres. The grids cover at least country borders and, where applicable, marine Exclusive Economic Zones v2.0, http://www.vliz.be/vmdcdata/marbound. Note that the extent of the grid into the marine area does not reflect the extent of the territorial waters.","The reference grids are based on ETRS89 Lambert Azimuthal Equal Area projection with parameters: latitude of origin 52°N, longitude of origin 10°E, false northing 3210000.0m, false easting 4321000.0m. Origin of the grid is calculated from 0mN 0mE of projection. The method followed the instructions for the EEA fishnet tool described in the EEA GIS guideline available from http://www.eionet.europa.eu/gis.","urn:ogc:def:crs:OGP Surveying & Positioning Committee::urn:ogc:def:crs:EPSG:7.1:3035","","","http://www.eea.europa.eu/data-and-maps/data/ds_resolveuid/035b0873a523d5003396e1a02c405361","","","","",Geographical grid systems,location,geoscientificInformation]
"14db112a-f0dc-4624-95e0-69e3c1c9d81c","eng","2014-03-28T19:29:12","Corine Land Cover 2000 - 2006 changes (vector) - version 17, Dec. 2013","","CHA06 is one of the datasets produced within the frame the Corine Land Cover programme referring to land cover / land use changes between year 2000 and 2006. The Corine Land Cover (CLC) is an European programme, coordinated by the European Environment Agency (EEA), providing consistent information on land cover and land cover changes across Europe. CLC products are based on the photointerpretation of satellite images by the national teams of the participating countries - the EEA member or cooperating countries. The resulting national land cover inventories are further integrated into a seamless land cover map of Europe. The resulting European database is based on standard methodology and nomenclature with following base parameters: - 44 classes in the hierarchical 3-level Corine nomenclature - minimum mapping unit (MMU) for status layers is 25 hectares - minimum width of linear elements is 100 metres - minimum mapping unit (MMU) for Land Cover Changes (LCC) for change layers is 5 hectares CLC programme provides important data sets supporting the implementation of key priority areas of the Environment Action Programmes of the European Community as protecting ecosystems, halting the loss of biological diversity, tracking the impacts of climate change, assessing developments in agriculture and implementing the EU Water Framework Directive etc.. CLC programme is also a part of the Global Monitoring for Environment and Security (GMES http://gmes.info) initiative, run by the European Commission and the European Space Agency, which will provide environmental information from a combination of air- and space-based observation systems and in-situ monitoring. More about the Corine Land Cover (CLC) programme and datasets can be found at http://www.eea.eu.","Vector CLC database was provided by National Teams within original CLC1990, I&CLC2000 update and FTSP/CLC2006 update projects. All features in original vector database were classified and digitised based on satellite images with 100 m positional accuracy (according to CLC specifications) and 25 ha minimum mapping unit into the standardized CLC nomenclature (44 CLC classes). European Corine Land Cover seamless DBs represent the final product of European data integration. The process of data integration started when national deliveries have been accepted and the Database Acceptance Report (DBTA) delivered. Delivered national data were produced in local national systems of all participating countries. Each national Coordinate Reference System (CRS) definition had to be known precisely together with its geometric relationship to a standard system in order to accurately transfer all national data into a standard European coordinate reference - ETRS89/LAEA1052. Mostly, the process itself was carried out by global equation-based transformation to ETRS89 (e.g. seven-parameters Bursa- Wolf methods). The accuracy of a particular transformation ranges from centimetres to meters depending on the method and the quality and number of control points available to define the transformation parameters, but, in any case, the accuracy is far above the actual CLC data resolution (for more details see the DBTA reports for particular country). National data, when transformed into the common European reference, are introduced into tiled pan-European structure and as final step seamless dataset is produced. In order to achieve production of the real seamless European database, the integration step includes also harmonization of database along country borders. It consists from edgematching of land cover polygons from the national databases across national borders done by a verification / re-interpretation of the satellite images in the border regions (2 km wide strip along borders). The satellite images from IMAGE2000. CLC90, CHA00 and CLC00 database were harmonized this way, but the order to priority was as following: CLC2000, both geometric and thematic adaptations of all polygons in a 2 km strip along national boundary lines; CHA00 database to ensure that changes in CLC2000 are consistent with the change database; corrected CLC90 (if provided by the MS); corrections were focused to geometric adaptations in semi-automatical way based on CLC00 and CHA00 databases. Border harmonization step has been skipped for CHA06 dataset and for CLC00 revised dataset. Simplified border harmonization step for CLC06 dataset has been created for these countries: CH, NO, KO, TR, IE. A simplified border matching has been applied: - <25 ha polygons are NOT systematically removed (see next bullet). - Sliver-like polygons (area < cca. 5 ha - soft limit) are generalised to largest or thematically most similar neighbour. - CLC-code differences in polygons along two sides of the border are NOT changed Note: Some artificial lines (dividing polygons with the same code) can be still present in database due to technical constraints of current ArcGIS technology, but has no impact for dataset contents and can be dissolved for data extracts.   Changes: Version 17 (V7) (12/2013) Production date: December 2nd, 2013 Release history: V7: 12/2013-Upgraded version -New part - Azores (PT) has been added V6: 04/2012-Upgraded version - New country - Turkey has been added. - Border matching for TR is not applied. - Polygons with change code 999-999 has been deleted. - Very small polygons which are not part of complex change or are not along country borders has been deleted. - Reprojected CHA00 data for Malta are included. Contains data for 29 countries V5: 07/2011 No changes between V4 and V5 Contains data for 28 countries V4: 10/2010 - Upgraded version - Provided as seamless Geodatabase in ETRS89/LAEA1052 CRS - Madeira Islands included - Contains data for 28 countries V3: 04/2010 - Upgraded version - provided as seamless Geodatabase in ETRS89/LAEA1052 CRS - Turkey included - Sea buffer (25km) introduced V2: 10/2009 - Upgraded version - tile borders artefacts reported by users corrected - new tiling introduced based on ETRS89/LAEA1052 grid - Norway included V1: 08/2005 - First release - in A/I Librarian in ETRS89 CRS - tiling follows IMAGE2000 tiling","urn:ogc:def:crs:OGP Surveying & Positioning Committee::urn:ogc:def:crs:EPSG:7.1:3035","","","http://www.eea.europa.eu/data-and-maps/data/ds_resolveuid/f497a90b18dc496b823e3b71137eff7a","","","","",Land cover,environment,geoscientificInformation]
"5bcc499a-8924-40a2-8437-ead942a5d9d2","eng","2015-01-08T12:34:38","EUNIS habitat type G1.6b distribution based on vegetation plot data - version 1, Jan. 2015","","The verified habitat samples used are derived from the Braun-Blanquet database (http://www.sci.muni.cz/botany/vegsci/braun_blanquet.php?lang=en) which is a centralised database of vegetation plots and comprises copies of national and regional databases using a unified taxonomic reference database.","The database compiled for the Braun-Blanquet project comprises various national and regional vegetation databases. The maintenance of these databases is in principle in the hands of the custodians. However, before uploading datasets into the Braun-Blanquet database a quality check is performed by Alterra and Masaryk University. If possible, detected errors are corrected and reported back to the data provider. Attributes added to the distribution data are: PLOTSOBSID (reference to the PlotObservationID in the database 'European Vegetation Data (2014 EUNIS forests).db') and PRECISION_M (precision in meters, indicating how precise the location is indicated).","urn:ogc:def:crs:OGP Surveying & Positioning Committee::urn:ogc:def:crs:EPSG:7.1:3035","","","http://www.eea.europa.eu/data-and-maps/data/ds_resolveuid/97bc44abffd54e12998008c57209e0eb","","","","",Habitats and biotopes,forest,natural area,terrestrial ecosystem,Europe,biota]
"e8498d84-2a5b-466c-9686-c4824680e6b6","eng","2013-07-08T16:15:26","EEA coastline for analysis (polygon) - version 1.0, Jun. 2013","","The criteria for defining the coastline is the line separating water from land. The EEA coastline is a product derived from two sources: EUHYDRO [link not available - yet] and GSHHG [http://www.soest.hawaii.edu/pwessel/gshhg/]  A priority defined in the input data, first EUHYDRO geometry and, as auxiliary data, GSHHG dataset. The EUHYDRO do not cover the requirement for EEA coastline. The EUHYDRO gaps are in Iceland, Canarias, Madeira, Azores, small islands (not represented in EUDEM) and the northern of Black Sea. The creation process was focused on generating the coastline as line dataset and, later, as a secondary product, defining the polygon layer sea-land. The fundamental step into the workflow was the selection of sea features using a water mask polygon (value in EUHYDRO datasets = 255). The inland water bodies (freshwaters) are rejected by this criteria, except the water bodies connected, at least by one point, to the sea (it is the cases of some transitional water bodies). A few manual amendments to the dataset were necessary to meet requirements from EU Nature Directives, Water Framework Directive and Marine Strategy Framework Directive.  This dataset is a polygon usable as a water-land mask.","Polygon: the polygon was derived from the parent dataset by adding two straight lines, one North-to-South, at the East-most part of the parent dataset, and the second one West-to-East, at the South–most part of the parent dataset. These 2 lines are taken from the NGA-derived coastline produced by the ETC-BD in 2008. Then a polygon dataset is created using the ArcGIS tool “Feature to Polygon”.","urn:ogc:def:crs:OGP Surveying & Positioning Committee::urn:ogc:def:crs:EPSG:7.1:3035","","","http://www.eea.europa.eu/data-and-maps/data/ds_resolveuid/f23e3a3a43344a088c5d76e2876a5f82","","","","",Elevation,coast,Europe,oceans,elevation]
