ID,language,date,title,abstract,description,source,crs,lowerCorner,upperCorner,link,download,thumbnail,large_thumbnail,protocol,subject
"2d0c4aad-85ee-476e-b58e-8a89cd3d5430","eng","2013-11-07T11:04:53","CDDA points for internal use - version 11, Jul. 2013","","The Common Database on Designated Areas (CDDA) is more commonly known as Nationally designated areas. The inventory began in 1995 under the CORINE programme of the European Commission. It is now one of the agreed Eionet priority data flows maintained by EEA with support from the European Topic Centre on Biological Diversity. It is a result of an annual data flow through Eionet countries. The EEA publishes the data set and makes it available to the World Database of Protected Areas (WDPA). The CDDA data can also be queried online in the European Nature Information System (EUNIS).   Geographical coverage of GIS vector boundary data: Albania, Austria, Belgium, Bosnia and Herzegovina, Bulgaria, Croatia, Cyprus, Czech Republic, Denmark, Estonia, Finland, Great Britain, Greece, Ireland, France, Germany, Iceland, Italy, Kosovo under UNSC Resolution 1244/99, Latvia, Liechtenstein, Lithuania, the former Yugoslav Republic of Macedonia, the Netherlands, Norway, Poland, Portugal, Romania, Serbia, Slovakia, Slovenia, Spain, Sweden and Switzerland. EEA does not have permission to distribute some or all sites reported by Austria, Estonia, Hungary, Ireland, Kosovo under UNSC Resolution 1244/99, Malta, the Netherlands, Romania, Slovenia and Turkey.   Copyright is to be mentioned for Estonia:  Estonian Environmental Register 18.02.2013. On-line resource linkage: www.keskkonnainfo.ee ; and for Finland:  ©Finnish Environment Institute, 2012 .","In 2013 for inclusion into version 11 of the ECDDA; 30 countries delivered tabular data and 31 countries delivered spatial data. These datasets were subjected to a series of quality control and quality assurance (QA/AC) checks. Once the data passed these tests it was combined with data for those countries that did not submit data in 2013, which was extracted from the previous CDDA dataset, version 10.","urn:ogc:def:crs:OGP Surveying & Positioning Committee::urn:ogc:def:crs:EPSG:7.1:3035","","","","","","","",Protected sites,Habitats and biotopes,Estonia,Sweden,Cyprus,Slovenia,Croatia,Bosnia and Herzegovina,Montenegro,the former Yugoslav Republic of Macedonia,Bulgaria,natural area,natural areas protection,protected area,environment]
"840383d1-6e67-44fc-9763-b2c539805be8","eng","2013-04-23T17:38:27","WISE GWB provisional dataset for horizons 6 and 7 - PUBLIC VERSION, Oct. 2012","","The shape file GWB_horizon_h6_h7 comprises thirty-one Italian GWBs located in the groundwater body horizons 6 and 7 of Sardinia. These GWBs had been reported for the first time in 2012 as an update of the reporting. They are aggregated into one shape file to underline the position that a threshold of five horizons should not be exceeded. 			 The dbf tables of the shape files include the columns “EU_CD_GW” as the GWB identifier and “Horizon” describing the vertical positioning. The polygon identifier “Polygon_ID” was added subsequently, because some GWBs consist of several polygons with identical “EU_CD_GW”even in the same horizon. Some further GWB characteristics are provided with the Microsoft Excel file “GWB_attributes_2012June.xls” including the column “EU_CD_GW”, which serves as a key for joining spatial and attribute data. There is no corresponding spatial data for GWBs in the Microsoft Excel table without an entry in column “EU_CD_GW”.   The spatial resolution is given for about a half of the GWBs in the column “Scale” of the xls file, which is varying between the MS from 1:10,000 to 1:1,000,000 and mostly in the range from 1:50,000 to 1:250,000.","All GWBs assigned to horizon 6 or horizon 7 are aggregated in the shape GWB_horizon_h6_h7 regardless the structure of shape files submitted by the MS with affiliation to horizons, River Basin Districts or both. The attribute table includes the fields “EU_CD_GW”, “Horizon” and the artificial polygon identifier “Polygon_ID”. The linking between the shape file and the Microsoft Excel table GWB_attributes_2012June.xls, which comprises further attributes, has to be carried out using column EU_CD_GW as key for joining the dbf table of the shape file with the xls file.","urn:ogc:def:crs:OGP Surveying & Positioning Committee::urn:ogc:def:crs:EPSG:7.1:4258","","","http://www.eea.europa.eu/data-and-maps/data/ds_resolveuid/28ab5e4028384e1484b6211d97c0f01d","","","","",Hydrography,Area management/restriction/regulation zones and reporting units,groundwater,aquifer,inlandWaters]
"bd74cfd5-9d4d-44c9-9ef9-67279c10e2fc","eng","2013-01-21T17:24:13","Soil maps of European Food Agency Data (EFSA), pH of the topsoil - version 1.0, Oct. 2010","","In the context of Service Level Agreement between JRC and EFSA, a series of datasets have been developed as support to the FATE and the ECOREGION EFSA PPR Working Groups. 			 			This dataset contains the topsoil pH. 			 			This metadata record is adapted from the orginal one received from JRC.","Refer to the JRC Technical Report entitled  EFSA Spatial Data Version 1.1 - Data Properties and Processing  [http://publications.jrc.ec.europa.eu/repository/handle/111111111/26754].","urn:ogc:def:crs:OGP Surveying & Positioning Committee::urn:ogc:def:crs:EPSG:7.1:3035","","","http://eusoils.jrc.ec.europa.eu/library/esdac/Esdac_DetailData2.cfm?id=25","","","","",Soil,soil,pH-value,geoscientificInformation]
"9d342efd-09da-4dbe-baa0-61cc54e1f598","eng","2012-03-30T11:11:42","Offshore wind farms, Jan. 2012","","Offshore Wind Farm locations and attribute data. List of main attributes provided in the spatial dataset:  + WindfarmId (ID of the windfarm)  + Name_1 (Name of the windfarm)  + OtherNames (Other name of the windfarm)  + CountryNam (Country where the windfarm is set)  + Comments (Comments)  + WindfarmSt (Windfarm Status or Project Status)  + CapacityMW (Capacity of the windfarm)  + NoTurbines (Number of turbines (probably those that are set in the windfarm))  + IsEstimate (IsEstimate is meant to read Is Estimated Location. This is where we know that a project exists but we don't know its exact location, for example, we know that its location off the coast from a given town. An example of this would be FR27 Cote d'Albatre II.)  + Developers (Developer(s) of the windfarm)  + Owners (Owner of the windfarm)  + Operators (Operator of the windfarm)","Different sources are used e.g. news reports, press releases, communications with companies.","urn:ogc:def:crs:OGP Surveying & Positioning Committee::urn:ogc:def:crs:EPSG:7.1:4326","","","","","","","",Energy resources,economy,structure,utilitiesCommunication]
"f461f13a-038c-4e3d-bfbe-22e91389dcef","eng","2015-09-16T22:21:13","Conservation status of species 2001-2006","","Gridded Distribution of Species as reported during the Article 17 of the Habitats Directive (92/43/EEC) covering the  period 2001 to 2006. The data covers the EU 25.    All Member States are requested by the Habitats Directive (92/43/EEC) to monitor habitat types and species considered to be of Community interest.   Article 17 of the Habitats Directive 92/43/EEC requires that every 6 years Member States prepare reports to be sent to the European Commission on the implementation of the Directive. The Article 17 report for the period 2001-2006 for the first time includes assessments on the conservation status of the habitat types and species of Community interest.   Information on the data quality of the 2001-2006 reporting round is available at http://bd.eionet.europa.eu/article17.","The Member State supplied species distribution was gridded to 10km or equivalent grids.  This was due to the extreme heterogeneity of the supplied data. The data set covers the EU 25 (Terrestrial and Marine) and corresponds to the period 2001 to 2006.  The data was supplied during the Article 17 (Habitats Directive 92/43/EEC) reporting process.","urn:ogc:def:crs:OGP Surveying & Positioning Committee::urn:ogc:def:crs:EPSG:7.1:3035","","","http://www.eea.europa.eu/data-and-maps/data/ds_resolveuid/F6548631-2C53-423E-A104-69C0C920920F","","","","",Habitats and biotopes,Protected sites,environment,biota]
"c5663efa-601b-4989-8e56-112ff709eaa0","eng","2012-08-09T12:01:46","EEA Fast Track Service Precursor on Land Monitoring - Degree of soil sealing 20m","","Raster data set of built-up and non built-up areas including continuous degree of soil sealing ranging from 0 - 100% in spatial resolution (20 x 20 m).","Documentation about the method used can be downloaded from the resource location.","urn:ogc:def:crs:OGP Surveying & Positioning Committee::urn:ogc:def:crs:EPSG:7.1:3035","","","http://www.eea.europa.eu/data-and-maps/data/ds_resolveuid/57ecd963002327759d99a3f2d1e1dfe1","","","","",Land cover,environment,geoscientificInformation]
"6e5d9b0d-a448-4c73-b008-bdd98a3cf214","eng","2014-03-21T16:12:54","Urban Morphological Zones 2006 (vector) - series","","This series references all versions of Urban Morphological Zones 2006 (vector) starting with version 13. A UMZ is defined as a  set of urban areas laying less than 200 m apart . Urban areas have been selected from Corine Land Cover 2006, by means of a methodology explained for each version of the dataset.","Input data: Corine Land Cover 2006 raster (100m)  The processing steps are described for each dataset in this series.","urn:ogc:def:crs:OGP Surveying & Positioning Committee::urn:ogc:def:crs:EPSG:7.1:3035","","","","","","","",Land cover,planningCadastre,society]
"1930445c-d742-4ed0-9ca1-f5a6d6059fe2","eng","2012-06-06T17:31:37","Corine Land Cover 2000 revised (vector)","","CLC00_revised is one of the datasets produced within the frame the Corine Land Cover programme referring to land cover / land use status of year 2000. The Corine Land Cover (CLC) is an European programme, coordinated by the European Environment Agency (EEA), providing consistent information on land cover and land cover changes across Europe. CLC products are based on the photointerpretation of satellite images by the national teams of the participating countries - the EEA member or cooperating countries. The resulting national land cover inventories are further integrated into a seamless land cover map of Europe. The resulting European database is based on standard methodology and nomenclature with following base parameters: - 44 classes in the hierarchical 3-level Corine nomenclature - minimum mapping unit (MMU) for status layers is 25 hectares - minimum width of linear elements is 100 metres - minimum mapping unit (MMU) for Land Cover Changes (LCC) for change layers is 5 hectares CLC programme provides important data sets supporting the implementation of key priority areas of the Environment Action Programmes of the European Community as protecting ecosystems, halting the loss of biological diversity, tracking the impacts of climate change, assessing developments in agriculture and implementing the EU Water Framework Directive etc.. CLC programme is also a part of the Global Monitoring for Environment and Security (GMES http://gmes.info) initiative, run by the European Commission and the European Space Agency, which will provide environmental information from a combination of air- and space-based observation systems and in-situ monitoring. More about the Corine Land Cover (CLC) programme and datasets can be found at http://www.eea.eu.","Vector CLC database was provided by National Teams within original CLC1990, I&CLC2000 update and FTSP/CLC2006 update projects. All features in original vector database were classified and digitised based on satellite images with 100 m positional accuracy (according to CLC specifications) and 25 ha minimum mapping unit into the standardized CLC nomenclature (44 CLC classes). European Corine Land Cover seamless DBs represent the final product of European data integration. The process of data integration started when national deliveries have been accepted and the Database Acceptance Report (DBTA) delivered . Delivered national data were produced in local national systems of all participating countries. Each national Coordinate Reference System (CRS) definition had to be known precisely together with its geometric relationship to a standard system in order to accurately transfer all national data into a standard European coordinate reference - ETRS89/LAEA1052. Mostly, the process itself was carried out by global equation-based transformation to ETRS89 (e.g. seven-parameters Bursa-Wolf methods). The accuracy of a particular transformation ranges from centimetres to meters depending on the method and the quality and number of control points available to define the transformation parameters, but, in any case, the accuracy is far above the actual CLC data resolution (for more details see the DBTA reports for particular country). National data, when transformed into the common European reference, are introduced into tiled pan-European structure and as final step seamless dataset is produced. In order to achieve production of the real seamless European database, the integration step includes also harmonization of database along country borders. It consists from edge-matching of land cover polygons from the national databases across national borders done by a verification / re-interpretation of the satellite images in the border regions (2 km wide strip along borders). The satellite images from IMAGE2000. CLC90, CHA00 and CLC00 database were harmonized this way, but the order to priority was as following: CLC2000, both geometric and thematic adaptations of all polygons in a 2 km strip along national boundary lines; CHA00 database to ensure that changes in CLC2000 are consistent with the change database; corrected CLC90 (if provided by the MS); corrections were focused to geometric adaptations in semi-automatical way based on CLC00 and CHA00 databases. Note: Some artificial lines (dividing polygons with the same code) can be still present in database due to technical constraints of current ArcGIS technology, but has no impact for dataset contents and can be dissolved for data extracts. Changes: Vector CLC database was provided by National Teams within original CLC1990, I&CLC2000 update and FTSP/CLC2006 update projects. All features in original vector database were classified and digitised based on satellite images with 100 m positional accuracy (according to CLC specifications) and 25 ha minimum mapping unit into the standardized CLC nomenclature (44 CLC classes). European Corine Land Cover seamless DBs represent the final product of European data integration. The process of data integration started when national deliveries have been accepted and the Database Acceptance Report (DBTA) delivered . Delivered national data were produced in local national systems of all participating countries. Each national Coordinate Reference System (CRS) definition had to be known precisely together with its geometric relationship to a standard system in order to accurately transfer all national data into a standard European coordinate reference - ETRS89/LAEA1052. Mostly, the process itself was carried out by global equation-based transformation to ETRS89 (e.g. seven-parameters Bursa-Wolf methods). The accuracy of a particular transformation ranges from centimetres to meters depending on the method and the quality and number of control points available to define the transformation parameters, but, in any case, the accuracy is far above the actual CLC data resolution (for more details see the DBTA reports for particular country). National data, when transformed into the common European reference, are introduced into tiled pan-European structure and as final step seamless dataset is produced. In order to achieve production of the real seamless European database, the integration step includes also harmonization of database along country borders. It consists from edge-matching of land cover polygons from the national databases across national borders done by a verification / re-interpretation of the satellite images in the border regions (2 km wide strip along borders). The satellite images from IMAGE2000. CLC90, CHA00 and CLC00 database were harmonized this way, but the order to priority was as following: CLC2000, both geometric and thematic adaptations of all polygons in a 2 km strip along national boundary lines; CHA00 database to ensure that changes in CLC2000 are consistent with the change database; corrected CLC90 (if provided by the MS); corrections were focused to geometric adaptations in semi-automatical way based on CLC00 and CHA00 databases. Note: Some artificial lines (dividing polygons with the same code) can be still present in database due to technical constraints of current ArcGIS technology, but has no impact for dataset contents and can be dissolved for data extracts.    CHANGES:Version 16 (V1) (04/2012) Production date: April 15th, 2012 Release history: V1: 04/2012 -Initial version 27 countries included","urn:ogc:def:crs:OGP Surveying & Positioning Committee::urn:ogc:def:crs:EPSG:7.1:3035","","","","","","","",Land cover,environment]
"d7103068-8cf2-4b9a-891a-4f0552915f78","eng","2012-01-23T13:27:13","Urban Atlas - Germany - Freiburg (Freiburg im Breisgau)","","The Urban Atlas is providing pan-European comparable land use and land cover data for Large Urban Zones with more than 100.000 inhabitants as defined by the Urban Audit. Urban Atlas' mission is to provide high-resolution hotspot mapping of changes in urban spaces and indicators for users such as city governments, the European Environment Agency (EEA) and European Commission departments.","Earth Observation (EO) Data used:                       * Spot 5 2,50 m - 50512520709131042331B6 (P) (Date: 2007/09/13)                        * Spot 5 2,50 m - 50512520709131042331B8 (P) (Date: 2007/09/13)                        * Spot 5 2,50 m - 50532520508051035452B5 (P) (Date: 2005/08/05)                        * Spot 5 2,50 m - 50532530509251054242B0 (P) (Date: 2005/09/25)                        * Spot 5 2,50 m - 50532530609211011491B7 (P) (Date: 2006/09/21)                        * ALOS 10 m - AL_AV2_X_20070419_100820_DLR_6569_PRUTM (XS) (Date: 2007/04/19)                        * ALOS 2,50 m - AL_PSM_P_20061008_103455_DLR_3754_PRUTM (P) (Date: 2006/10/08)                        * ALOS 2,50 m - AL_PSM_P_20070624_103346_DLR_7532_PRUTM (P) (Date: 2007/06/24)                        * ALOS 2,50 m - AL_PSM_P_20070624_103350_DLR_7532_PRUTM (P) (Date: 2007/06/24)                        * ALOS 2,50 m - AL_PSM_P_20080511_103047_DLR_12229_PRUTM (P) (Date: 2008/05/11)                        * ALOS 2,50 m - AL_PSM_P_20080511_103052_DLR_12229_PRUTM (P) (Date: 2008/05/11)                        * ALOS 2,50 m - AL_PSM_P_20090415_103631_DLR_17174_PRUTM (P) (Date: 2009/04/15)                        * ALOS 2,50 m - AL_PSM_P_20090415_103635_DLR_17174_PRUTM (P) (Date: 2009/04/15)                        * ALOS 2,50 m - AL_PSM_P_20090415_103639_DLR_17174_PRUTM (P) (Date: 2009/04/15)","urn:ogc:def:crs:OGP Surveying & Positioning Committee::urn:ogc:def:crs:EPSG:7.1:32632","","","http://www.eea.europa.eu/data-and-maps/data/ds_resolveuid/9df69b925454fd267512ea65898dbbdc","","","","",Land use,urban area,land use,Germany,Freiburg,society]
"5c8e945b-7a8d-4eca-b62f-6af53689d2af","","2013-02-13","Ratio of irrigation water consumption to water availability (ClimWatAdapt project, 2025, EcF)","","The ratio of irrigation water consumption to water availability during June, July and August for 2025, SCENES scenario Economy First (EcF).In order to assess the vulnerability of the agricultural sector to climate change, the indicator “irrigation consumption-to-water availability” (c.t.a.) is introduced. Irrigation consumption refers to the part of the irrigation water that is really “consumed” by the crops and evapotranspirates (net irrigation requirements).The amount of water used for irrigation has been calculated for the base year based on the baseline climate (1961-90). It must be noted that the future irrigation water requirements were calculated within SCENES, i.e. the climate change input differs from the climate data used in the ClimWatAdapt framework because another emission scenario and different GCM output were applied. The assessment is performed on the river basin level for average annual conditions as well as for the summer season (JJA). This indicator does not consider the reduction of natural flow by upstream consumptive use, thus the water resources are only available for irrigation.By using this indicator, it is assumed that a drainage basin suffers from severe water stress if c.t.a. > 0.3 or, in other words, if irrigation consumption exceeds 40% of reliable annual (or seasonal) water availability. A c.t.a. below 0.3 indicates low to mid water stress. The thresholds are chosen arbitrarily but have been derived from EEA (2003) which shows a figure for the water consumption index ranging from (almost) zero to 30% in Europe. According to EEA (2003), the average water consumption index in Europe is 3%.","The annual water consumption for irrigation is modelled by WaterGAP. The water consumption for irrigation during June, July and August is calculated by dividing the annual water consumption for irrigation by 4. The water availability during June, July and August is modelled by LISFLOOD.","urn:ogc:def:crs:::EPSG:4258","","","","","","","OGC:WMS-1.1.1-http-get-map",water management,agriculture,irrigation,ClimWatAdapt,water,Atmospheric conditions,climatologyMeteorologyAtmosphere]
"99d4a09b-ae81-4600-a787-b35899a46121f","eng","2012-01-10T14:35:45","EEA reference grid for Switzerland (1km), May 2013","","The grid is based on proposal at the 1st European Workshop on Reference Grids in 2003 and later INSPIRE geographical grid systems. The sample grid available here is part of a set of three polygon grids in 1, 10 and 100 kilometres. The grids cover at least country borders and, where applicable, marine Exclusive Economic Zones v7.0, http://www.marineregions.org. Note that the extent of the grid into the marine area does not reflect the extent of the territorial waters.","The reference grids are based on ETRS89 Lambert Azimuthal Equal Area projection with parameters: latitude of origin 52°N, longitude of origin 10°E, false northing 3210000.0m, false easting 4321000.0m. Origin of the grid is calculated from 0mN 0mE of projection. The method followed the instructions for the EEA fishnet tool described in the EEA GIS guideline available from http://www.eionet.europa.eu/gis. All grids have been created using one of the two scripts available in the scripts subfolder located in the data directory. Their usage is documented in the readme.txt file available in the same subfolder.","urn:ogc:def:crs:OGP Surveying & Positioning Committee::urn:ogc:def:crs:EPSG:7.1:3035","","","http://www.eea.europa.eu/data-and-maps/data/eea-reference-grids-2","","","","",Geographical grid systems,location]
"bb796039-8210-46b6-bebb-77f3c6ee5997f","eng","2012-01-10T16:39:57","EEA reference grid for Finland (10km), May 2013","","The grid is based on proposal at the 1st European Workshop on Reference Grids in 2003 and later INSPIRE geographical grid systems. The sample grid available here is part of a set of three polygon grids in 1, 10 and 100 kilometres. The grids cover at least country borders and, where applicable, marine Exclusive Economic Zones v7.0, http://www.marineregions.org. Note that the extent of the grid into the marine area does not reflect the extent of the territorial waters.","The reference grids are based on ETRS89 Lambert Azimuthal Equal Area projection with parameters: latitude of origin 52°N, longitude of origin 10°E, false northing 3210000.0m, false easting 4321000.0m. Origin of the grid is calculated from 0mN 0mE of projection. The method followed the instructions for the EEA fishnet tool described in the EEA GIS guideline available from http://www.eionet.europa.eu/gis. All grids have been created using one of the two scripts available in the scripts subfolder located in the data directory. Their usage is documented in the readme.txt file available in the same subfolder.","urn:ogc:def:crs:OGP Surveying & Positioning Committee::urn:ogc:def:crs:EPSG:7.1:3035","","","http://www.eea.europa.eu/data-and-maps/data/eea-reference-grids-2","","","","",Geographical grid systems,location]
"9346a4a7-1377-4e48-bedd-23653caf2685","eng","2012-01-23T13:27:13","Urban Atlas - Austria - Graz","","The Urban Atlas is providing pan-European comparable land use and land cover data for Large Urban Zones with more than 100.000 inhabitants as defined by the Urban Audit. Urban Atlas' mission is to provide high-resolution hotspot mapping of changes in urban spaces and indicators for users such as city governments, the European Environment Agency (EEA) and European Commission departments.","Earth Observation (EO) Data used:                       * Spot 5 2,50 m - 00182800015 (PS) (Date: 2006/07/21)                        * Spot 5 2,50 m - 00182800037 (PS) (Date: 2007/08/05)                        * Spot 5 2,50 m - 00182800042 (PS) (Date: 2007/10/17)","urn:ogc:def:crs:OGP Surveying & Positioning Committee::urn:ogc:def:crs:EPSG:7.1:32633","","","http://www.eea.europa.eu/data-and-maps/data/ds_resolveuid/9df69b925454fd267512ea65898dbbdc","","","","",Land use,urban area,land use,Austria,Graz,society]
