ID,language,date,title,abstract,description,source,crs,lowerCorner,upperCorner,link,download,thumbnail,large_thumbnail,protocol,subject
"fec237c7-49f2-42b6-ba13-dc3cbebb43d9","eng","2012-08-06T11:32:45","Corine Land Cover 1990 - 2000 harmonised changes, formation code in changed areas (raster 100m)","","100m resolution raster version of the European CLC-changes (1990-2000) vector data. CLC change mapping aimed to delineate all CLC change features larger than 5 ha (see CLC2006 Technical Guidelines in the specification). CLC-changes (2000-2006) raster data have been harmonized with CLC-changes (1990-2000) raster data.","CLC change mapping aimed to delineate all CLC change features larger than 5 ha (see CLC2006 Technical Guidelines in the specification). Production steps for version 16 include:  - Delineation of change features larger than 5 ha based on IMAGE1990 and IMAGE2000 satellite imagery + ancillary data,  - Merging country databases into a European database,  - Rasterization of European CLC-change(1990-2000)data (CELL CENTER method)  - Harmonization of European CLC-change(2000-2006) and CLC-change(1990-2000) raster data in order to eliminate remaining contradictions on overlaps between the two dataset   CLC-changes (1990-2000) raster data have been harmonized with CLC-changes (2000-2006) raster data. More information on EEA's Corine Land Cover publications: http://www.eea.europa.eu/publications#c9=all&c7=en&b_start=0&c13=corine+land+cover","urn:ogc:def:crs:OGP Surveying & Positioning Committee::urn:ogc:def:crs:EPSG:7.1:3035","","","","","","","",Land cover,Land cover,environment]
"ce876c49-e1c8-446c-9133-ff04c17d2417","eng","2015-09-17T16:42:59","EEA coastline for analysis (raw) - version 2.0, Jun. 2015","","The EEA coastline for analysis is created for highly detailed analysis, e.g. 1:100 000, for geographical Europe. The coastline is a hybrid product obtained from projects using satellite imagery as data source: EUHYDRO [link not available - yet] and GSHHG [http://www.soest.hawaii.edu/pwessel/gshhg/]. The defining criteria was altitude level = 0 from EUDEM [will become available from EEA website]. Outside the coverage of the EUDEM, the coastline from GSHHG was used without modifications. A few manual amendments to the dataset were necessary to meet requirements from EU Nature Directives, Water Framework Directive and Marine Strategy Framework Directive. In 2015, several corrections were made in the Kalogeroi Islands (coordinates 38.169, 25.287) and two other greek little islets (coordinates 36.766264, 23.604318), as well as in the peninsula of Porkkala (around coordinates 59.99, 24.42).","","urn:ogc:def:crs:OGP Surveying & Positioning Committee::urn:ogc:def:crs:EPSG:7.1:3035","","","","","","","",Elevation,coast,Europe,oceans,elevation]
"667b1137-d84e-4abb-9340-5bb8f6cc0e40","eng","2012-01-23T13:27:13","Urban Atlas - Romania - Oradea","","The Urban Atlas is providing pan-European comparable land use and land cover data for Large Urban Zones with more than 100.000 inhabitants as defined by the Urban Audit. Urban Atlas' mission is to provide high-resolution hotspot mapping of changes in urban spaces and indicators for users such as city governments, the European Environment Agency (EEA) and European Commission departments.","Earth Observation (EO) Data used:                       * Spot 5 2,50 m - 00186394037 (PS) (Date: 2007/04/08)","urn:ogc:def:crs:OGP Surveying & Positioning Committee::urn:ogc:def:crs:EPSG:7.1:32634","","","http://www.eea.europa.eu/data-and-maps/data/ds_resolveuid/9df69b925454fd267512ea65898dbbdc","","","","",Land use,urban area,land use,Romania,Oradea,society]
"650c3735-28c7-43bb-b521-3952ce4d6246","eng","2012-08-06T18:14:18","Urban Atlas - series","","The Urban Atlas is providing pan-European comparable land use and land cover data for Large Urban Zones with more than 100.000 inhabitants as defined by the Urban Audit. Urban Atlas' mission is to provide high-resolution hotspot mapping of changes in urban spaces and indicators for users such as city governments, the European Environment Agency (EEA) and European Commission departments.","Urban Atlas contains information derived mainly from Earth Observation (EO) data with support by other reference data, such as COTS navigation data and topographic maps.","urn:ogc:def:crs:WMS 1.3.0  Automatic Projections  authority::urn:ogc:def:crs:AUTO2::42001","","","http://www.eea.europa.eu/data-and-maps/data/ds_resolveuid/9df69b925454fd267512ea65898dbbdc","","","","",Land use,urban area,land use,society]
"902043ca-1683-4eea-91b9-1efab31d1f5e","eng","2012-01-10T14:35:37","High Nature Value Farmland eu 1 km","","The grid contains the result of the CLC2000 reselection plus national datasets up-scaled to 1 km.","Check .pdf document","urn:ogc:def:crs:OGP Surveying & Positioning Committee::urn:ogc:def:crs:EPSG:7.1:3035","","","","","","","",Land cover,environment,geoscientificInformation]
"380c4c6f-410a-4f60-8ddc-c13e53b607db","eng","2012-10-03T16:26:04","Geographic Information System of the European Commission (GISCO), Aug. 2012","","GISCO is a Eurostat service which promotes and stimulates the use of GIS within the European Statistical System and the Commission. It is responsible for the management and dissemination of the Geographical reference database of the Commission. It produces maps, spatial analysis, promotes geo-referencing of statistics and provides user support for Commission users of GIS. GISCO is one of the leaders of the INSPIRE initiative, supporting the implementation of the directive for the establishment of a European Spatial Data Infrastructure. The datasets extracted from GISCO in August 2012 are for the year 2010:   + Administrative boundaries at country level   + Coastlines   + Communes   + EEZ   + NUTS    These metadata are derived from the original metadata records available at Inspire@EC.","The dataset is based on the geometry from EBM v5.0. of EuroGeographics for the members of Eurogeographics, the Global Administrative Units Layer (2008) from FAO (UN) and geometry from the Turkish National Statistical Office. This resulted in a common repository of geometry of which the different datasets were derived. The different scale levels were derived of generalisations of the common repository on 100K scale. This means that within each scale level the feature classes of all these datasets: COMM_2010, NUTS_2010, CNTR_2010, EEZ_2010 and COAS_2010, are fully coherent and compliant. Each scale level in the CNTR_2010 dataset consists of 2 feature classes (regions and boundaries) The boundaries and regions are related to each other through a relationship table. In addition to the region and boundary feature classes there is also 1 label feature class which is scale independent. For each CNTR in the region feature class there is exactly 1 label. Further information on the validity and lineage is available in the database manual on the INSPIRE@EC group on CIRCABC. https://circabc.europa.eu/w/browse/bf8ae55b-a09b-4f24-a0b8-1f5784e0080c","urn:ogc:def:crs:OGP Surveying & Positioning Committee::urn:ogc:def:crs:EPSG:7.1:4258","","","","","","","",Administrative units,administrative boundary,boundaries]
"2e9f9435-b47a-4f2d-bb2f-c61b8c7f7b1f","eng","2015-01-08T12:34:38","EUNIS habitat type G2.1 distribution based on vegetation plot data - version 1, Jan. 2015","","The verified habitat samples used are derived from the Braun-Blanquet database (http://www.sci.muni.cz/botany/vegsci/braun_blanquet.php?lang=en) which is a centralised database of vegetation plots and comprises copies of national and regional databases using a unified taxonomic reference database.","The database compiled for the Braun-Blanquet project comprises various national and regional vegetation databases. The maintenance of these databases is in principle in the hands of the custodians. However, before uploading datasets into the Braun-Blanquet database a quality check is performed by Alterra and Masaryk University. If possible, detected errors are corrected and reported back to the data provider. Attributes added to the distribution data are: PLOTSOBSID (reference to the PlotObservationID in the database 'European Vegetation Data (2014 EUNIS forests).db') and PRECISION_M (precision in meters, indicating how precise the location is indicated).","urn:ogc:def:crs:OGP Surveying & Positioning Committee::urn:ogc:def:crs:EPSG:7.1:3035","","","http://www.eea.europa.eu/data-and-maps/data/ds_resolveuid/97bc44abffd54e12998008c57209e0eb","","","","",Habitats and biotopes,forest,natural area,terrestrial ecosystem,Europe,biota]
"0d3fae51-1873-4f46-acb5-5cd2e2ad2544f","eng","2012-01-10T14:35:36","EEA reference grid for Kosovo (UNSCR 1244/99) (100km), May 2013","","The grid is based on proposal at the 1st European Workshop on Reference Grids in 2003 and later INSPIRE geographical grid systems. The sample grid available here is part of a set of three polygon grids in 1, 10 and 100 kilometres. The grids cover at least country borders and, where applicable, marine Exclusive Economic Zones v7.0, http://www.marineregions.org. Note that the extent of the grid into the marine area does not reflect the extent of the territorial waters.","The reference grids are based on ETRS89 Lambert Azimuthal Equal Area projection with parameters: latitude of origin 52°N, longitude of origin 10°E, false northing 3210000.0m, false easting 4321000.0m. Origin of the grid is calculated from 0mN 0mE of projection. The method followed the instructions for the EEA fishnet tool described in the EEA GIS guideline available from http://www.eionet.europa.eu/gis. All grids have been created using one of the two scripts available in the scripts subfolder located in the data directory. Their usage is documented in the readme.txt file available in the same subfolder.","urn:ogc:def:crs:OGP Surveying & Positioning Committee::urn:ogc:def:crs:EPSG:7.1:3035","","","http://www.eea.europa.eu/data-and-maps/data/eea-reference-grids-2","","","","",Geographical grid systems,location]
"e8d89987-d6e5-43f0-b8c4-ced7ace7c0dff","eng","2012-01-10T14:34:49","EEA reference grid for Germany (100km), May 2013","","The grid is based on proposal at the 1st European Workshop on Reference Grids in 2003 and later INSPIRE geographical grid systems. The sample grid available here is part of a set of three polygon grids in 1, 10 and 100 kilometres. The grids cover at least country borders and, where applicable, marine Exclusive Economic Zones v7.0, http://www.marineregions.org. Note that the extent of the grid into the marine area does not reflect the extent of the territorial waters.","The reference grids are based on ETRS89 Lambert Azimuthal Equal Area projection with parameters: latitude of origin 52°N, longitude of origin 10°E, false northing 3210000.0m, false easting 4321000.0m. Origin of the grid is calculated from 0mN 0mE of projection. The method followed the instructions for the EEA fishnet tool described in the EEA GIS guideline available from http://www.eionet.europa.eu/gis. All grids have been created using one of the two scripts available in the scripts subfolder located in the data directory. Their usage is documented in the readme.txt file available in the same subfolder.","urn:ogc:def:crs:OGP Surveying & Positioning Committee::urn:ogc:def:crs:EPSG:7.1:3035","","","http://www.eea.europa.eu/data-and-maps/data/eea-reference-grids-2","","","","",Geographical grid systems,location]
"98bd2c15-1a6d-4717-9850-01e3a44fe60ef","eng","2012-01-10T14:35:56","EEA reference grid for Montenegro (1km), May 2013","","The grid is based on proposal at the 1st European Workshop on Reference Grids in 2003 and later INSPIRE geographical grid systems. The sample grid available here is part of a set of three polygon grids in 1, 10 and 100 kilometres. The grids cover at least country borders and, where applicable, marine Exclusive Economic Zones v7.0, http://www.marineregions.org. Note that the extent of the grid into the marine area does not reflect the extent of the territorial waters.","The reference grids are based on ETRS89 Lambert Azimuthal Equal Area projection with parameters: latitude of origin 52°N, longitude of origin 10°E, false northing 3210000.0m, false easting 4321000.0m. Origin of the grid is calculated from 0mN 0mE of projection. The method followed the instructions for the EEA fishnet tool described in the EEA GIS guideline available from http://www.eionet.europa.eu/gis. All grids have been created using one of the two scripts available in the scripts subfolder located in the data directory. Their usage is documented in the readme.txt file available in the same subfolder.","urn:ogc:def:crs:OGP Surveying & Positioning Committee::urn:ogc:def:crs:EPSG:7.1:3035","","","http://www.eea.europa.eu/data-and-maps/data/eea-reference-grids-2","","","","",Geographical grid systems,location]
"c89e5d9a-911e-4772-bec9-909e487d9e25","eng","2012-02-21T16:14:23","Urban Atlas - Bulgaria - Ruse (Русе)","","The Urban Atlas is providing pan-European comparable land use and land cover data for Large Urban Zones with more than 100.000 inhabitants as defined by the Urban Audit. Urban Atlas' mission is to provide high-resolution hotspot mapping of changes in urban spaces and indicators for users such as city governments, the European Environment Agency (EEA) and European Commission departments.","Earth Observation (EO) Data used:                       * Spot 5 2,50 m - 50922610508300914472B0 (PS) (Date: 2005/08/30)                        * Spot 5 2,50 m - 50922610709280913532B9 (PS) (Date: 2007/09/28)","urn:ogc:def:crs:OGP Surveying & Positioning Committee::urn:ogc:def:crs:EPSG:7.1:32635","","","http://www.eea.europa.eu/data-and-maps/data/ds_resolveuid/9df69b925454fd267512ea65898dbbdc","","","","",Land use,urban area,land use,Bulgaria,Ruse,society]
"7a9764ac-c2b4-4953-9ef0-969d621d4d9b","eng","2013-01-25T21:57:54","Arsenic (As) concentration in topsoils, Sep. 2007","","Maps of estimated total arsenic concentrations in soils using 1588 geo-referenced topsoil samples from the FOREGS Geochemical database. The concentrations were interpolated using block regression-kriging over the 26 European countries that contributed to the database.  			 			Heavy metal contents are expressed in mg kg-1. 			 			This metadata record is adapted from the orginal one received from JRC.","Refer to http://eusoils.jrc.ec.europa.eu/foregshmc/ and to Rodriguez Lado, L., Hengl, T., Reuter, H.I., (2008) Heavy metals in European soils: a geostatistical analysis of the FOREGS Geochemical database. Geoderma 148, 189-199.  [http://www.sciencedirect.com/science/article/pii/S0016706108002668].","urn:ogc:def:crs:OGP Surveying & Positioning Committee::urn:ogc:def:crs:EPSG:7.1:3035","","","http://eusoils.jrc.ec.europa.eu/library/esdac/Esdac_DetailData2.cfm?id=9","","","","",Soil,soil,arsenic,heavy metal,concentration,geoscientificInformation]
"1808bf4b-761f-4ffd-a000-dececbda5e0e","eng","2012-01-10T14:35:50","EEA reference grid for Greece (10km), May 2011","","The grid is based on proposal at the 1st European Workshop on Reference Grids in 2003 and later INSPIRE geographical grid systems. The sample grid available here is part of a set of three polygon grids in 1, 10 and 100 kilometres. The grids cover at least country borders and, where applicable, marine Exclusive Economic Zones v2.0, http://www.vliz.be/vmdcdata/marbound. Note that the extent of the grid into the marine area does not reflect the extent of the territorial waters.","The reference grids are based on ETRS89 Lambert Azimuthal Equal Area projection with parameters: latitude of origin 52°N, longitude of origin 10°E, false northing 3210000.0m, false easting 4321000.0m. Origin of the grid is calculated from 0mN 0mE of projection. The method followed the instructions for the EEA fishnet tool described in the EEA GIS guideline available from http://www.eionet.europa.eu/gis.","urn:ogc:def:crs:OGP Surveying & Positioning Committee::urn:ogc:def:crs:EPSG:7.1:3035","","","http://www.eea.europa.eu/data-and-maps/data/ds_resolveuid/035b0873a523d5003396e1a02c405361","","","","",Geographical grid systems,location,geoscientificInformation]
"34200209-d918-4dcd-a48e-dea86c6ff37a","eng","2013-02-13","Change in annual mean temperature between 1961-1990 and 2071-2100 (ESPON Climate project)","","Change in annual mean temperature in 2 metres above surface. Climatic changes derived from a comparison of 1961 - 1990 and 2071 - 2100 climate projections by the CCLM model for the IPCC SRES A1B scenario.","Climatic changes derived from a comparison of 1961 - 1990 and 2071 - 2100 climate projections by the CCLM model for the IPCC SRES A1B scenario.","urn:ogc:def:crs:::EPSG:4258","","","","","","","OGC:WMS-1.1.1-http-get-map",Atmospheric conditions,climatologyMeteorologyAtmosphere]
