ID,language,date,title,abstract,description,source,crs,lowerCorner,upperCorner,link,download,thumbnail,large_thumbnail,protocol,subject
"81ddbbee-78c1-4362-a156-68950610568cf","eng","2012-01-10T14:36:08","EEA reference grid for Azores (10km), May 2013","","The grid is based on proposal at the 1st European Workshop on Reference Grids in 2003 and later INSPIRE geographical grid systems. The sample grid available here is part of a set of three polygon grids in 1, 10 and 100 kilometres. The grids cover at least country borders and, where applicable, marine Exclusive Economic Zones v7.0, http://www.marineregions.org. Note that the extent of the grid into the marine area does not reflect the extent of the territorial waters.","The reference grids are based on ETRS89 Lambert Azimuthal Equal Area projection with parameters: latitude of origin 52°N, longitude of origin 10°E, false northing 3210000.0m, false easting 4321000.0m. Origin of the grid is calculated from 0mN 0mE of projection. The method followed the instructions for the EEA fishnet tool described in the EEA GIS guideline available from http://www.eionet.europa.eu/gis. All grids have been created using one of the two scripts available in the scripts subfolder located in the data directory. Their usage is documented in the readme.txt file available in the same subfolder.","urn:ogc:def:crs:OGP Surveying & Positioning Committee::urn:ogc:def:crs:EPSG:7.1:3035","","","http://www.eea.europa.eu/data-and-maps/data/eea-reference-grids-2","","","","",Geographical grid systems,location]
"04c8ef74-d29e-415d-9a45-3ac71b339800","eng","2012-01-23T13:27:13","Urban Atlas - Germany - Koblenz","","The Urban Atlas is providing pan-European comparable land use and land cover data for Large Urban Zones with more than 100.000 inhabitants as defined by the Urban Audit. Urban Atlas' mission is to provide high-resolution hotspot mapping of changes in urban spaces and indicators for users such as city governments, the European Environment Agency (EEA) and European Commission departments.","Earth Observation (EO) Data used:                       * Spot 5 2,50 m - 50482480607141038081B0 (PS) (Date: 2006/07/14)                        * Spot 5 2,50 m - 50492470703111021401B7 (PS) (Date: 2007/03/11)                        * ALOS 2,5 m - AL_AV2_X_20080701_103603_DLR_12973_PRUTM (XS) (Date: 2008/07/01)                        * ALOS 2,5 m - AL_AV2_X_20080701_103611_DLR_12973_PRUTM (XS) (Date: 2008/07/01)                        * ALOS 2,5 m - AL_PSM_P_20080701_103603_DLR_12973_PRUTM (P) (Date: 2008/07/01)                        * ALOS 2,5 m - AL_PSM_P_20080701_103607_DLR_12973_PRUTM (P) (Date: 2008/07/01)","urn:ogc:def:crs:OGP Surveying & Positioning Committee::urn:ogc:def:crs:EPSG:7.1:32632","","","http://www.eea.europa.eu/data-and-maps/data/ds_resolveuid/9df69b925454fd267512ea65898dbbdc","","","","",Land use,urban area,land use,Germany,Koblenz,society]
"69704f5d-fd59-4a9f-a339-e9b3bae62564","eng","2012-01-23T13:27:13","Urban Atlas - Greece - Volos (Βόλος)","","The Urban Atlas is providing pan-European comparable land use and land cover data for Large Urban Zones with more than 100.000 inhabitants as defined by the Urban Audit. Urban Atlas' mission is to provide high-resolution hotspot mapping of changes in urban spaces and indicators for users such as city governments, the European Environment Agency (EEA) and European Commission departments.","Earth Observation (EO) Data used:                       * ALOS 2,50 m - AL_AV2_X_20070615_092526_DLR_7400_PREU (XS) (Date: 2007/06/15)                        * ALOS 2,50 m - AL_PSM_P_20080502_092231_DLR_12097_PREU (P) (Date: 2008/05/02)                        * ALOS 2,50 m - AL_PSM_P_20080502_092235_DLR_12097_PREU (P) (Date: 2008/05/02)","urn:ogc:def:crs:OGP Surveying & Positioning Committee::urn:ogc:def:crs:EPSG:7.1:32634","","","http://www.eea.europa.eu/data-and-maps/data/ds_resolveuid/9df69b925454fd267512ea65898dbbdc","","","","",Land use,urban area,land use,Greece,Volos,society]
"01000d62-1669-49c8-8ffa-24df1f857b51","eng","2012-01-23T13:27:13","Urban Atlas - Belgium - Charleroi","","The Urban Atlas is providing pan-European comparable land use and land cover data for Large Urban Zones with more than 100.000 inhabitants as defined by the Urban Audit. Urban Atlas' mission is to provide high-resolution hotspot mapping of changes in urban spaces and indicators for users such as city governments, the European Environment Agency (EEA) and European Commission departments.","Earth Observation (EO) Data used:                       * Spot 5 2,50 m - 00183538014 (PS) (Date: 2005/08/29)","urn:ogc:def:crs:OGP Surveying & Positioning Committee::urn:ogc:def:crs:EPSG:7.1:32631","","","http://www.eea.europa.eu/data-and-maps/data/ds_resolveuid/9df69b925454fd267512ea65898dbbdc","","","","",Land use,urban area,land use,Belgium,Charleroi,society]
"7bd28405-0f3f-4737-830a-ee80762c6aaf","eng","2012-01-10T14:35:00","WISE River basin districts subunits (RBDSU) - version 1.4, Jun. 2011","","River Basin Districts (RBDs) and/or their subunits are the main units for the management of river basins and have been delineated by Member States under Article 3 of the Water Framework Directive. The geographic area of some RBDs span more than one country (such as the Danube) and these are known as International RBDs. Others are contained completely within a country and are known as National RBDs. River basin districts are defined as the area of land and sea, made up of one or more neighbouring river basins together with their associated groundwaters and coastal waters, which is identified under Article 3(1) as the main unit for management of river basins. Coastal waters are defined as one nautical mile from the coastline and extending, where appropriate, up to the outer limit of transitional waters. Coastal waters are included in RBDs, but this is not consistenly reported by Member States. Transitional waters are defined as bodies of surface water in the vicinity of river mouths which are partly saline in character as a result of their proximity to coastal waters but which are substantially influenced by freshwater flows. For more information about European waters, please visit the WISE portal (http://water.europa.eu/).","Refer to pdf document eea_v_3035_250_k_rbd-f1v4_2011_rev1-4_dataset_lineage.pdf","urn:ogc:def:crs:OGP Surveying & Positioning Committee::urn:ogc:def:crs:EPSG:7.1:3035","","","http://www.eea.europa.eu/data-and-maps/data/ds_resolveuid/1a8341df70e6c1faefee3fed3d50c2fa","","","","",Area management/restriction/regulation zones and reporting units,Hydrography,inlandWaters,geoscientificInformation,boundaries]
"4986a487-7584-4a37-a6b3-bbd883da74b2","eng","2012-12-11T17:56:10","Near real time measurements of ozone (O3) concentration for the current year","","Near real time ozone concentration measurements transmitted to EEA by national and regional air quality networks (http://www.eea.europa.eu/themes/air/air-quality/resources/who-provides-the-air-quality-data). The measurements are preliminary and may be changed at any time by the data providers following their quality control procedures. The measurements may not be used for compliance purposes.","Near real time ozone concentration measurements transmitted to EEA by national and regional air quality networks are collated in a harmonized dataset.","urn:ogc:def:crs:OGP Surveying & Positioning Committee::urn:ogc:def:crs:EPSG:7.1:4326","","","http://discomap.eea.europa.eu/ArcGIS/rest/services/ExtractData/Air/GPServer/NRTAirData/execute","","","","",Atmospheric conditions,Human health and safety,Environmental monitoring facilities,air quality monitoring,atmospheric composition,atmospheric pollution,transboundary pollution,tropospheric ozone,ozone,environment,climatologyMeteorologyAtmosphere,health]
"0e97fc9e-9a3f-4e3e-80a2-92cc49fd4cc0f","eng","2012-01-10T14:34:37","EEA reference grid for Estonia (100km), May 2013","","The grid is based on proposal at the 1st European Workshop on Reference Grids in 2003 and later INSPIRE geographical grid systems. The sample grid available here is part of a set of three polygon grids in 1, 10 and 100 kilometres. The grids cover at least country borders and, where applicable, marine Exclusive Economic Zones v7.0, http://www.marineregions.org. Note that the extent of the grid into the marine area does not reflect the extent of the territorial waters.","The reference grids are based on ETRS89 Lambert Azimuthal Equal Area projection with parameters: latitude of origin 52°N, longitude of origin 10°E, false northing 3210000.0m, false easting 4321000.0m. Origin of the grid is calculated from 0mN 0mE of projection. The method followed the instructions for the EEA fishnet tool described in the EEA GIS guideline available from http://www.eionet.europa.eu/gis. All grids have been created using one of the two scripts available in the scripts subfolder located in the data directory. Their usage is documented in the readme.txt file available in the same subfolder.","urn:ogc:def:crs:OGP Surveying & Positioning Committee::urn:ogc:def:crs:EPSG:7.1:3035","","","http://www.eea.europa.eu/data-and-maps/data/eea-reference-grids-2","","","","",Geographical grid systems,location]
"9faab055-6e5d-484b-8831-1193503e7f2df","eng","2012-01-10T14:36:03","EEA reference grid for Belgium (100km), May 2013","","The grid is based on proposal at the 1st European Workshop on Reference Grids in 2003 and later INSPIRE geographical grid systems. The sample grid available here is part of a set of three polygon grids in 1, 10 and 100 kilometres. The grids cover at least country borders and, where applicable, marine Exclusive Economic Zones v7.0, http://www.marineregions.org. Note that the extent of the grid into the marine area does not reflect the extent of the territorial waters.","The reference grids are based on ETRS89 Lambert Azimuthal Equal Area projection with parameters: latitude of origin 52°N, longitude of origin 10°E, false northing 3210000.0m, false easting 4321000.0m. Origin of the grid is calculated from 0mN 0mE of projection. The method followed the instructions for the EEA fishnet tool described in the EEA GIS guideline available from http://www.eionet.europa.eu/gis. All grids have been created using one of the two scripts available in the scripts subfolder located in the data directory. Their usage is documented in the readme.txt file available in the same subfolder.","urn:ogc:def:crs:OGP Surveying & Positioning Committee::urn:ogc:def:crs:EPSG:7.1:3035","","","http://www.eea.europa.eu/data-and-maps/data/eea-reference-grids-2","","","","",Geographical grid systems,location]
"afa92aa0-1a59-41ca-a4af-97b2574d221c","eng","2012-01-23T13:27:13","Urban Atlas - Germany - Weimar","","The Urban Atlas is providing pan-European comparable land use and land cover data for Large Urban Zones with more than 100.000 inhabitants as defined by the Urban Audit. Urban Atlas' mission is to provide high-resolution hotspot mapping of changes in urban spaces and indicators for users such as city governments, the European Environment Agency (EEA) and European Commission departments.","Earth Observation (EO) Data used:                       * Spot 5 2,50 m - 50572460507111015562B8 (P) (Date: 2005/07/11)                        * Spot 5 2,50 m - 50572470507111016042B0 (P) (Date: 2005/07/11)                        * ALOS 10 m - AL_AV2_X_20070416_094355_DLR_6525_PRUTM (XS) (Date: 2007/04/16)                        * ALOS 10 m - AL_AV2_X_20070416_094403_DLR_6525_PRUTM (XS) (Date: 2007/04/16)                        * ALOS 2,50 m - AL_PSM_P_20070504_102629_DLR_6788_PRUTM (P) (Date: 2007/05/04)                        * ALOS 2,50 m - AL_PSM_P_20070504_102633_DLR_6788_PRUTM (P) (Date: 2007/05/04)","urn:ogc:def:crs:OGP Surveying & Positioning Committee::urn:ogc:def:crs:EPSG:7.1:32632","","","http://www.eea.europa.eu/data-and-maps/data/ds_resolveuid/9df69b925454fd267512ea65898dbbdc","","","","",Land use,urban area,land use,Germany,Weimar,society]
"f2c50658-8871-405f-9c7c-434e255f4aca","eng","2012-01-23T13:27:13","Urban Atlas - Czech Republic - Ústí nad Labem","","The Urban Atlas is providing pan-European comparable land use and land cover data for Large Urban Zones with more than 100.000 inhabitants as defined by the Urban Audit. Urban Atlas' mission is to provide high-resolution hotspot mapping of changes in urban spaces and indicators for users such as city governments, the European Environment Agency (EEA) and European Commission departments.","Earth Observation (EO) Data used:                       * Spot 5 2,50 m - 00183538019 (PS) (Date: 2005/09/21)                        * Spot 5 2,50 m - 00183538065 (PS) (Date: 2007/09/30)","urn:ogc:def:crs:OGP Surveying & Positioning Committee::urn:ogc:def:crs:EPSG:7.1:32633","","","http://www.eea.europa.eu/data-and-maps/data/ds_resolveuid/9df69b925454fd267512ea65898dbbdc","","","","",Land use,urban area,land use,Czech Republic,Ústí nad Labem,society]
"7e091972-c587-4cd7-b01e-7fd0e7aecf93","eng","2013-01-25T21:59:23","Nickel (Ni) concentration in topsoils, Sep. 2007","","Maps of estimated total nickel concentrations in soils using 1588 geo-referenced topsoil samples from the FOREGS Geochemical database. The concentrations were interpolated using block regression-kriging over the 26 European countries that contributed to the database.  			 			Heavy metal contents are expressed in mg kg-1. 			 			This metadata record is adapted from the orginal one received from JRC.","Refer to http://eusoils.jrc.ec.europa.eu/foregshmc/ and to Rodriguez Lado, L., Hengl, T., Reuter, H.I., (2008) Heavy metals in European soils: a geostatistical analysis of the FOREGS Geochemical database. Geoderma 148, 189-199.  [http://www.sciencedirect.com/science/article/pii/S0016706108002668].","urn:ogc:def:crs:OGP Surveying & Positioning Committee::urn:ogc:def:crs:EPSG:7.1:3035","","","http://eusoils.jrc.ec.europa.eu/library/esdac/Esdac_DetailData2.cfm?id=9","","","","",Soil,soil,nickel,heavy metal,concentration,geoscientificInformation]
"47a26fe5-2a3e-4b12-9949-7a84770b8f86","eng","2012-01-23T13:27:13","Urban Atlas - Poland - Jelenia Góra","","The Urban Atlas is providing pan-European comparable land use and land cover data for Large Urban Zones with more than 100.000 inhabitants as defined by the Urban Audit. Urban Atlas' mission is to provide high-resolution hotspot mapping of changes in urban spaces and indicators for users such as city governments, the European Environment Agency (EEA) and European Commission departments.","Earth Observation (EO) Data used:                       * Spot 5 2,50 m - 50652470709241029441B0 (PS) (Date: 2007/09/24)","urn:ogc:def:crs:OGP Surveying & Positioning Committee::urn:ogc:def:crs:EPSG:7.1:32633","","","http://www.eea.europa.eu/data-and-maps/data/ds_resolveuid/9df69b925454fd267512ea65898dbbdc","","","","",Land use,urban area,land use,Poland,Jelenia Góra,society]
"5c20713e-29a3-4f8b-b9fd-3b32f5c0d1fd","eng","2013-03-22T18:10:27","Imperviousness 2009, degrees of imperviousness 100m - Jan. 2013","","High resolution land cover data for built-up areas with degree of imperviousness 2009. Histogram smoothing procedure was applied to solve minor inconsistencies. Classes: 0: Unsealed 1-100: Degrees of Sealing / Imperviousness 254: Clouds, No data 255: Outside area","Refer to the country reports under geoland2_r_3035_xxx_m_imperviousness_2009/documentation.","urn:ogc:def:crs:OGP Surveying & Positioning Committee::urn:ogc:def:crs:EPSG:7.1:3035","","","","","","","",Land cover,soil surface sealing,sealing,built environment,imageryBaseMapsEarthCover]
"d9aaec80-0d51-42de-97ba-11ab219c2ba4","eng","2012-06-06T14:22:22","Corine Land Cover 2000 (raster 250m) - series","","This series references all versions of Corine Land Cover 2000, raster 250m starting with version 13.   With the help of CLC data it is possible to provide support for protecting ecosystems, halting the loss of biological diversity, tracking the impacts of climate change, assessing developments in agriculture and implementing the EU Water Framework Directive.    CLC data is an important data set for the implementation of key priority areas of the Sixth Environment Action Programme of the European Community. CLC data can show, for instance, where fragmentation of the landscape by roads and other infrastructure is worsening and thus increasing the risk that ecosystems can no longer connect with each other, putting the survival of their flora and fauna in danger. In the agricultural field CLC data can highlight where major structural changes are continuing or intensifying, such as the conversion of pasture to arable land, expansion or reduction in the area of fallow land and land taken out of production ('set aside'), or the abandonment of farming altogether. CLC serve as input to the EC 'Inspire' (INfrastructure for SPatial InfoRmation in Europe - http://inspire.jrc.it) initiative. This initiative intends to trigger the creation of a European spatial information infrastructure that delivers to the users integrated spatial information services. CLC programme is also a contribution to the Global Monitoring for Environment and Security (GMES http://gmes.info) initiative, run by the European Commission and the European Space Agency, to provide environmental information from a combination of air- and space-based observation systems and in-situ monitoring.","Product is based on CLC databases provided by National Teams within CLC mapping related projects (I&CLC2000, CARDS, FTSP/CLC2006 update etc.. All features in original vector database were classified and digitised based on satellite images with 100 m positional accuracy (according to CLC specifications) and 25 ha minimum mapping unit (5ha MMU for changes) into the standardized CLC nomenclature (44 CLC classes). LCEUGRIDS represent the final product of European CLC data integration. The process of data integration started when national CLC deliveries have been accepted. Delivered national data were produced in local national systems of all participating countries. Each national Coordinate Reference System (CRS) definition had to be known precisely together with its geometric relationship to a standard system in order to accurately transfer all national data into a standard coordinate reference (LAEA5210/ETRS89) for European wide geographic data. Mostly, the process itself was carried out by global equation-based transformation to ETRS89 (e.g. seven-parameters Bursa-Wolf methods). The accuracy of a particular transformation ranges from centimetres to meters depending on the method and the quality and number of control points available to define the transformation parameters, but, in any case, the accuracy is far above the actual CLC2000 data resolution (for more details see DBTA reports for particular country). Due to large data volume, national data, when transformed into the common European reference, are rasterized. The resolution of the data is 100 x 100 and 250 x 250 metres (change grids 100 x 100 metres).","urn:ogc:def:crs:OGP Surveying & Positioning Committee::urn:ogc:def:crs:EPSG:7.1:3035","","","","","","","",Land cover,environment,geoscientificInformation]
"3b933931-f2df-4d0b-8a8a-a2c02399b75c","eng","2013-04-08T17:37:11","WISE GWB provisional dataset for Switzerland - INTERNAL VERSION, Oct. 2012","","Switzerland as a non EU member state delivers GWB data on a voluntary basis. All 124 GWBs submitted with the update in 2012 are allocated to horizon 1. 			 The dbf tables of the shape files include the columns “EU_CD_GW” as the GWB identifier and “Horizon” describing the vertical positioning. The polygon identifier “Polygon_ID” was added subsequently, because some GWBs consist of several polygons with identical “EU_CD_GW”even in the same horizon. Some further GWB characteristics are provided with the Microsoft Excel file “GWB_attributes_2012June.xls” including the column “EU_CD_GW”, which serves as a key for joining spatial and attribute data. There is no corresponding spatial data for GWBs in the Microsoft Excel table without an entry in column “EU_CD_GW”.   The spatial resolution is given for about a half of the GWBs in the column “Scale” of the xls file, which is varying between the MS from 1:10,000 to 1:1,000,000 and mostly in the range from 1:50,000 to 1:250,000.","Switzerland provided one shape file for each GWB. All of the GWBs are allocated to horizon 1 and are merged into a single shape file. The attribute table of the aggregated shape file includes the columns “GWB_Code” ,“GWB_Name” and “Horizon”.  There is no matching to the Microsoft Excel table GWB_attributes_2012June.xls, which provides further GWB attributes.","urn:ogc:def:crs:OGP Surveying & Positioning Committee::urn:ogc:def:crs:EPSG:7.1:4258","","","","","","","",Hydrography,Area management/restriction/regulation zones and reporting units,groundwater,aquifer,inlandWaters]
"8bb64993-e19d-4d67-87d4-c86128f1d33d","eng","2012-10-16T16:36:18","Offshore wind farms, Sep. 2012","","Offshore Wind Farm locations and attribute data. List of main attributes provided in the spatial dataset:  + WindfarmId (ID of the windfarm)  + Name (Name of the windfarm)  + Country (Country code)  + Status (Status code)  + WindfarmStatus (Windfarm Status or Project Status)  + StatusComments (Comments on the Windfarm Status or Project Status)  + CapacityMWMin (Capacity of the windfarm - Min)  + CapacityMWMax (Capacity of the windfarm - Max)  + NoTurbinesMin (Number of turbines - Min)  + NoTurbinesMax (Number of turbines - Max)  + Comments (Comments)  + TurbineMWMin (Capacity of the turbine (set-up in the windfarm) - Min)  + TurbineMWMax (Capacity of the turbine (set-up in the windfarm) - Max)  + OtherNames (Other name of the windfarm)  + CountryName (Country where the windfarm is set)  + Lat (Geographic coordinate - centre latitude)  + Lon (Geographic coordinate - centre longitude)  + IsEstimatedLocation (This is where we know that a project exists but we don't know its exact location.)  + IsOnHold  + Developers (Developer(s) of the windfarm)  + Owners (Owner of the windfarm)  + Operators (Operator of the windfarm)","Different sources are used e.g. news reports, press releases, communications with companies.","urn:ogc:def:crs:OGP Surveying & Positioning Committee::urn:ogc:def:crs:EPSG:7.1:4326","","","","","","","",Energy resources,economy,structure,utilitiesCommunication]
"56f4508d-a565-4673-9cda-52a75a5f6d66","eng","2013-03-22T18:10:44","Imperviousness 2009, degrees of imperviousness 20m - Jan. 2013","","High resolution land cover data for built-up areas with degree of imperviousness 2009. Histogram smoothing procedure was applied to solve minor inconsistencies. Classes: 0: Unsealed 1-100: Degrees of Sealing / Imperviousness 254: Clouds, No data 255: Outside area","Pixel-based layer of built-up areas including degree of soil sealing. It serves as an update of the soil sealing layer of 2006.  Methodology comprises the following steps: a) A hybrid automated classification with supervised and unsupervised elements, leading to binary maps of built-up areas b) Manual correction of the binary map to obtain the required quantitative thematic accuracy (85%) as well as good qualitative results c) Derivation of the soil sealing levels based on the NDVI (Normalised Difference Vegetation Index). A histogram smoothing procedure was applied where gaps in the histogram are partially filled. The sealing 09 degrees have been modified by no more than 1 sealing degree (up or down) for this purpose. Refer to the country reports under geoland2_r_3035_xxx_m_imperviousness_2009/documentation for further details.","urn:ogc:def:crs:OGP Surveying & Positioning Committee::urn:ogc:def:crs:EPSG:7.1:3035","","","","","","","",Land cover,soil surface sealing,sealing,built environment,imageryBaseMapsEarthCover]
"b0a22226-80a3-4d9b-babb-789e57f8c05d","eng","2012-01-10T14:35:33","EEA reference grid for United Kingdom (100km), May 2011","","The grid is based on proposal at the 1st European Workshop on Reference Grids in 2003 and later INSPIRE geographical grid systems. The sample grid available here is part of a set of three polygon grids in 1, 10 and 100 kilometres. The grids cover at least country borders and, where applicable, marine Exclusive Economic Zones v2.0, http://www.vliz.be/vmdcdata/marbound. Note that the extent of the grid into the marine area does not reflect the extent of the territorial waters.","The reference grids are based on ETRS89 Lambert Azimuthal Equal Area projection with parameters: latitude of origin 52°N, longitude of origin 10°E, false northing 3210000.0m, false easting 4321000.0m. Origin of the grid is calculated from 0mN 0mE of projection. The method followed the instructions for the EEA fishnet tool described in the EEA GIS guideline available from http://www.eionet.europa.eu/gis.","urn:ogc:def:crs:OGP Surveying & Positioning Committee::urn:ogc:def:crs:EPSG:7.1:3035","","","http://www.eea.europa.eu/data-and-maps/data/ds_resolveuid/035b0873a523d5003396e1a02c405361","","","","",Geographical grid systems,location,geoscientificInformation]
