ID,language,date,title,abstract,description,source,crs,lowerCorner,upperCorner,link,download,thumbnail,large_thumbnail,protocol,subject
"9302aca8-d3c7-43b2-b64f-f42bec35e7a4","eng","2012-01-10T14:36:06","European and Mediterranean Basin extract of LandScan Global Population Database 2008","","This dataset consists of the LandScan global population database of 2008 (grid in WGS84 with a 30  resolution) clipped to Europe together with the Mediterranean Basin, converted into a population density dataset and reprojected to EPSG:3035 (Lambert Azimuthal Equal Area 52N10E / ETRS89) with a spatial resolution of 1km². The methodology applied aimed at minimizing any discrepancy in population counts between the original data and the reprojected data at country level. Content: population count per grid cell. No data value: -99","The methodology used consisted in: a) clipping an area of interest from the original LandScan data (http://www.ornl.gov/sci/landscan/) in WGS84 lat/lon b) calculating the corresponding population density in inhabitants per km² (still in WGS84 lat/lon) c) projecting b) to ETRS89 - Lambert Azimuthal Equal Area 52N10E (epsg:3035) with a resolution of 1km   This methodology is described in the document landscan_paul.pdf.  In this document, some references are made to a similar product created by Hermann Peifer registered in the catalogue with the metadata ID 1d68d314-d07c-4205-8852-f74b364cd699","urn:ogc:def:crs:OGP Surveying & Positioning Committee::urn:ogc:def:crs:EPSG:7.1:3035","","","","","","","",Population distribution — demography,society]
"06f9055f-4467-4167-a48e-3358134c6fcd","eng","2013-03-22T18:16:57","Revised Soil Sealing 2006, built-up mask 100m - Jan. 2013","","The built-up mask is the status map of 2006. It contains all available built-up information. It is derived from the Sealing Degrees product. The built-up mask is divided into two classes (imperviousness below 80% vs imperviousness of 80% or more) to reflect common definitions of urban areas.  Classes: 0:	Area outside of WR 1:	Discontinuous Built-up 2006 - Sealing Levels 1-79% 2:	Continuous Built-up 2006 - Sealing Levels 80-100% 3:	Non built-up 2006 4:	Clouds 2006","Refer to the country reports under geoland2_r_3035_xxx_m_revised-soil-sealing_2006/documentation.","urn:ogc:def:crs:OGP Surveying & Positioning Committee::urn:ogc:def:crs:EPSG:7.1:3035","","","","","","","",Land cover,soil surface sealing,sealing,built environment,imageryBaseMapsEarthCover]
"ceba8505-c9ee-4cdd-a939-b135c7691203","eng","2012-08-23T12:21:17","LandScan Global Population Database 2008","","LandScan Global Population Database 2008. Population counts at 30 arc second resolution.","The methodology is documented at http://www.ornl.gov/sci/landscan/landscan_documentation.shtml","urn:ogc:def:crs:OGP Surveying & Positioning Committee::urn:ogc:def:crs:EPSG:7.1:4326","","","","","","","",Population distribution — demography,society]
"702e2157-d9c9-4306-9d02-5d69b409b783","eng","2012-06-06T14:53:58","Corine Land Cover 2006 seamless (vector) - version 13, Feb. 2010","","CLC06 is one of the datasets produced within the frame the Corine Land Cover programme referring to land cover / land use status of year 2006. The Corine Land Cover (CLC) is an European programme, coordinated by the European Environment Agency (EEA), providing consistent information on land cover and land cover changes across Europe. CLC products are based on the photointerpretation of satellite images by the national teams of the participating countries - the EEA member or cooperating countries. The resulting national land cover inventories are further integrated into a seamless land cover map of Europe. The resulting European database is based on standard methodology and nomenclature with following base parameters: - 44 classes in the hierarchical 3-level Corine nomenclature - minimum mapping unit (MMU) for status layers is 25 hectares - minimum width of linear elements is 100 metres - minimum mapping unit (MMU) for Land Cover Changes (LCC) for change layers is 5 hectares CLC programme provides important data sets supporting the implementation of key priority areas of the Environment Action Programmes of the European Community as protecting ecosystems, halting the loss of biological diversity, tracking the impacts of climate change, assessing developments in agriculture and implementing the EU Water Framework Directive etc.. CLC programme is also a part of the Global Monitoring for Environment and Security (GMES http://gmes.info) initiative, run by the European Commission and the European Space Agency, which will provide environmental information from a combination of air- and space-based observation systems and in-situ monitoring. More about the Corine Land Cover (CLC) programme and datasets can be found at http://www.eea.eu.","Vector CLC database was provided by National Teams within original CLC1990, I&CLC2000 update and FTSP/CLC2006 update projects. All features in original vector database were classified and digitised based on satellite images with 100 m positional accuracy (according to CLC specifications) and 25 ha minimum mapping unit into the standardized CLC nomenclature (44 CLC classes). European Corine Land Cover seamless DBs represent the final product of European data integration. The process of data integration started when national deliveries have been accepted and the Database Acceptance Report (DBTA) delivered . Delivered national data were produced in local national systems of all participating countries. Each national Coordinate Reference System (CRS) definition had to be known precisely together with its geometric relationship to a standard system in order to accurately transfer all national data into a standard European coordinate reference - ETRS89/LAEA1052. Mostly, the process itself was carried out by global equation-based transformation to ETRS89 (e.g. seven-parameters Bursa-Wolf methods). The accuracy of a particular transformation ranges from centimetres to meters depending on the method and the quality and number of control points available to define the transformation parameters, but, in any case, the accuracy is far above the actual CLC data resolution (for more details see the DBTA reports for particular country). National data, when transformed into the common European reference, are introduced into tiled pan-European structure and as final step seamless dataset is produced. In order to achieve production of the real seamless European database, the integration step includes also harmonization of database along country borders. It consists from edge-matching of land cover polygons from the national databases across national borders done by a verification / re-interpretation of the satellite images in the border regions (2 km wide strip along borders). The satellite images from IMAGE2000. CLC90, CHA00 and CLC00 database were harmonized this way, but the order to priority was as following: CLC2000, both geometric and thematic adaptations of all polygons in a 2 km strip along national boundary lines; CHA00 database to ensure that changes in CLC2000 are consistent with the change database; corrected CLC90 (if provided by the MS); corrections were focused to geometric adaptations in semi-automatical way based on CLC00 and CHA00 databases. Border harmonization step has been skipped for CHA06 and CLC06 datasets. Note: Some artificial lines (dividing polygons with the same code) can be still present in database due to technical constraints of current ArcGIS technology, but has no impact for dataset contents and can be dissolved for data extracts. CHANGES:Version 1 (04/2010) Production date: April 14th, 2010 Contents of the dataset is consistent with LCEUGRID release v13 (02/2010) Release history: V1: 04/2010 - First release - provided as seamless Geodatabase in ETRS89/LAEA1052 CRS - contains 36 countries - Sea buffer (25km) introduced","urn:ogc:def:crs:OGP Surveying & Positioning Committee::urn:ogc:def:crs:EPSG:7.1:3035","","","http://www.eea.europa.eu/data-and-maps/data/ds_resolveuid/51eb60177a093293c7751a0006117203","","","","",Land cover,environment,geoscientificInformation]
"4ead9faf-5732-4dd2-aaf1-4b10db063fe9","eng","2012-06-06T14:37:12","Corine Land Cover 1990 (raster 100m) - version 15, Aug. 2011","","With the help of CLC data it is possible to provide support for protecting ecosystems, halting the loss of biological diversity, tracking the impacts of climate change, assessing developments in agriculture and implementing the EU Water Framework Directive. CLC data is an important data set for the implementation of key priority areas of the Sixth Environment Action Programme of the European Community. CLC data can show, for instance, where fragmentation of the landscape by roads and other infrastructure is worsening and thus increasing the risk that ecosystems can no longer connect with each other, putting the survival of their flora and fauna in danger. In the agricultural field CLC data can highlight where major structural changes are continuing or intensifying, such as the conversion of pasture to arable land, expansion or reduction in the area of fallow land and land taken out of production ('set aside'), or the abandonment of farming altogether. CLC serve as input to the EC 'Inspire' (INfrastructure for SPatial InfoRmation in Europe - http://inspire.jrc.it) initiative. This initiative intends to trigger the creation of a European spatial information infrastructure that delivers to the users integrated spatial information services. CLC programme is also a contribution to the Global Monitoring for Environment and Security (GMES http://gmes.info) initiative, run by the European Commission and the European Space Agency, to provide environmental information from a combination of air- and space-based observation systems and in-situ monitoring.","Product is based on CLC databases provided by National Teams within CLC mapping related projects (I&CLC2000, CARDS, FTSP/CLC2006 update etc.. All features in original vector database were classified and digitised based on satellite images with 100 m positional accuracy (according to CLC specifications) and 25 ha minimum mapping unit (5ha MMU for changes) into the standardized CLC nomenclature (44 CLC classes). LCEUGRIDS represent the final product of European CLC data integration. The process of data integration started when national CLC deliveries have been accepted. Delivered national data were produced in local national systems of all participating countries. Each national Coordinate Reference System (CRS) definition had to be known precisely together with its geometric relationship to a standard system in order to accurately transfer all national data into a standard coordinate reference (LAEA5210/ETRS89) for European wide geographic data. Mostly, the process itself was carried out by global equation-based transformation to ETRS89 (e.g. seven-parameters Bursa-Wolf methods). The accuracy of a particular transformation ranges from centimetres to meters depending on the method and the quality and number of control points available to define the transformation parameters, but, in any case, the accuracy is far above the actual CLC2000 data resolution (for more details see DBTA reports for particular country). Due to large data volume, national data, when transformed into the common European reference, are rasterized. The resolution of the data is 100 x 100 and 250 x 250 metres (change grids 100 x 100 metres).","urn:ogc:def:crs:OGP Surveying & Positioning Committee::urn:ogc:def:crs:EPSG:7.1:3035","","","http://www.eea.europa.eu/data-and-maps/data/ds_resolveuid/dd8682b07c63113cfeeee680109039a3","","","","",Land cover,environment,geoscientificInformation]
"9b099df4-16be-4937-a76d-e52616341961","eng","2013-01-22T17:12:59","European Soil Database (ESDB) - version 2.0, Sep. 2001","","The Soil Geographical Database of Eurasia at Scale 1:1,000,000 is part of the European Soil Informaton System (EUSIS). It is the resulting product of a collaborative project involving all the European Union and neighbouring countries. It is a simplified representation of the diversity and spatial variability of the soil coverage. The methodology used to differentiate and name the main soil types is based on the terminology of the F.A.O. legend for the Soil Map of the World at Scale 1:5,000,000. This terminology has been refined and adapted to take account of the specificities of the landscapes in Europa. It is itself founded on the distinction of the main pedogenetic processes leading to soil differentiation: brunification, lessivage, podzolisation, hydromorphy, etc.  The database contains a list of Soil Typological Units (STU). Besides the soil names they represent, these units are described by variables (attributes) specifying the nature and properties of the soils: for example the texture, the water regime, the stoniness, etc. The geographical representation was chosen at a scale corresponding to the 1:1,000,000. At this scale, it is not feasible to delineate the STUs. Therefore they are grouped into Soil Mapping Units (SMU) to form soil associations and to illustrate the functioning of pedological systems within the landscapes.  Harmonisation of the soil data from the member countries is based on a dictionary giving the definition for each occurrence of the variables. Considering the scale, the precision of the variables is weak. Furthermore these variables were estimated over large areas by expert judgement rather than measured on local soil samples. This expertise results from synthesis and generalisation tasks of national or regional maps published at more detailed scales, for example 1:50,000 or 1:25,000 scales. Delineation of the Soil Mapping Units is also the result of expertise and experience. Heterogeneity can be considerable in European regions. The spatial variability of soils is very important and is difficult to express at global levels of precision. Quality indices of the information (purity and confidence level) are included with the data in order to guide usage.  This metadata record is adapted from the orginal one received from JRC.","Refer to http://eusoils.jrc.ec.europa.eu/ESDB_Archive/ESDBv2/fr_intro.htm","urn:ogc:def:crs:European Environment Agency::urn:ogc:def:crs:EEA:1.0:777101","","","http://eusoils.jrc.ec.europa.eu/library/esdac/Esdac_DetailData2.cfm?id=1","","","","",Soil,Soil,geoscientificInformation]
"a1be022f-c4be-4a0f-bbc0-f83811a2798d","eng","2012-01-10T14:36:14","EEA reference grid for Lithuania (100km), May 2011","","The grid is based on proposal at the 1st European Workshop on Reference Grids in 2003 and later INSPIRE geographical grid systems. The sample grid available here is part of a set of three polygon grids in 1, 10 and 100 kilometres. The grids cover at least country borders and, where applicable, marine Exclusive Economic Zones v2.0, http://www.vliz.be/vmdcdata/marbound. Note that the extent of the grid into the marine area does not reflect the extent of the territorial waters.","The reference grids are based on ETRS89 Lambert Azimuthal Equal Area projection with parameters: latitude of origin 52°N, longitude of origin 10°E, false northing 3210000.0m, false easting 4321000.0m. Origin of the grid is calculated from 0mN 0mE of projection. The method followed the instructions for the EEA fishnet tool described in the EEA GIS guideline available from http://www.eionet.europa.eu/gis.","urn:ogc:def:crs:OGP Surveying & Positioning Committee::urn:ogc:def:crs:EPSG:7.1:3035","","","http://www.eea.europa.eu/data-and-maps/data/ds_resolveuid/035b0873a523d5003396e1a02c405361","","","","",Geographical grid systems,location,geoscientificInformation]
"4c0a1d44-95e7-4bb0-858b-c478d403c9d8","eng","2012-01-10T14:35:27","EEA reference grid for Ireland (1km), May 2011","","The grid is based on proposal at the 1st European Workshop on Reference Grids in 2003 and later INSPIRE geographical grid systems. The sample grid available here is part of a set of three polygon grids in 1, 10 and 100 kilometres. The grids cover at least country borders and, where applicable, marine Exclusive Economic Zones v2.0, http://www.vliz.be/vmdcdata/marbound. Note that the extent of the grid into the marine area does not reflect the extent of the territorial waters.","The reference grids are based on ETRS89 Lambert Azimuthal Equal Area projection with parameters: latitude of origin 52°N, longitude of origin 10°E, false northing 3210000.0m, false easting 4321000.0m. Origin of the grid is calculated from 0mN 0mE of projection. The method followed the instructions for the EEA fishnet tool described in the EEA GIS guideline available from http://www.eionet.europa.eu/gis.","urn:ogc:def:crs:OGP Surveying & Positioning Committee::urn:ogc:def:crs:EPSG:7.1:3035","","","http://www.eea.europa.eu/data-and-maps/data/ds_resolveuid/035b0873a523d5003396e1a02c405361","","","","",Geographical grid systems,location,geoscientificInformation]
"5b3cbeb2-0f70-4ea2-b1ae-29748c1133fc","eng","2012-08-06T14:15:29","Natura 2000 1 km (raster) - end 2011","","This dataset was built from the original Natura 2000 vector. The raster grid is aligned with the EEA reference grid GeoTIFFs generated by GRASS, according to the GeoTIFF Revision 1.0 specifications at http://www.remotesensing.org/geotiff/spec/geotiffhome.html. The information displays if there is or not Natura 2000 sites under each specific pixel zone.","This dataset was built from the original Natura 2000 vector, public version. The raster grid is aligned with the EEA reference grid GeoTIFFs generated by GRASS, according to the GeoTIFF Revision 1.0 specifications at http://www.remotesensing.org/geotiff/spec/geotiffhome.html.  0. The input vector data, from EEA SDI http://sdi.eea.europa.eu/catalogue/srv/eng/search?uuid=cc3eadf2-fed8-4262-99ef-bd639ade1eb8  1. Rasterisation with GDAL tools (takes ~2 hours) $ for res in 100 250 1000 ; do   gdal_rasterize Natura2000_End2011.shp Natura2000_End2011_${res}m.tif \       -ot byte -a_nodata 0 -co compress=deflate -co tiled=yes -tr $res $res -tap -burn 1 & done","urn:ogc:def:crs:OGP Surveying & Positioning Committee::urn:ogc:def:crs:EPSG:7.1:3035","","","","","","","",Protected sites,environment,geoscientificInformation]
"32d946b6-4d60-4108-bcdb-2b2e2fec5477","eng","2013-03-22T18:17:45","Revised Soil Sealing 2006, degrees of sealing 100m - Jan. 2013","","Raster data set of built-up and non built-up areas including continuous degree of soil sealing ranging from 0 - 100% in spatial resolution (100 x 100 m). 			 Classes: 0: 	Unsealed 1-100: 	Degrees of Sealing / Imperviousness 254: 	Clouds, No data 255:	Outside area","Refer to the country reports under geoland2_r_3035_xxx_m_revised-soil-sealing_2006/documentation.","urn:ogc:def:crs:OGP Surveying & Positioning Committee::urn:ogc:def:crs:EPSG:7.1:3035","","","","","","","",Land cover,soil surface sealing,sealing,built environment,imageryBaseMapsEarthCover]
"24cdf846-e0d3-4884-84c7-9930d5b29c38","eng","2012-01-10T14:34:46","Lacoast - Land cover change in coastal areas 1975-1990","","LaCoast is a research project undertaken in the mid 1990 under the lead of the Joint Research Centre (JRC) and aimed at quantifying the changes of land cover types in a 10 km land strip from the coastline. LaCoast uses CORINE Land Cover version 1990 as its reference dataset and track differences of land cover changes using LANDSAT satellite images from the mid-1970's.","n/a","urn:ogc:def:crs:European Environment Agency::urn:ogc:def:crs:EEA:1.0:777101","","","","","","","",Land cover,environment,geoscientificInformation]
"0b7f34af-0202-4ae4-aa06-ae4d91b8c9fa","eng","2012-01-10T14:35:29","LandScan Global Population Database 2010","","LandScan Global Population Database 2010. Population counts at 30 arc second resolution.","n/a","urn:ogc:def:crs:OGP Surveying & Positioning Committee::urn:ogc:def:crs:EPSG:7.1:4326","","","","","","","",Population distribution — demography,society,geoscientificInformation]
"10b2fdf5-83df-405d-8b2e-842faf54f407","eng","2012-10-03T16:22:40","GISCO - Administrative units 2010 at country level, Aug. 2012","","This data set contains the administrative boundaries at country level of the world and is based on the geometry from EBM v5.0. of EuroGeographics for the members of Eurogeographics, the Global Administrative Units Layer (2008) from FAO (UN) and geometry from the Turkish National Statistical Office. This dataset consists of 2 feature classes (regions, boundaries) per scale level and there are 6 different scale levels (100K, 1M, 3M, 10M, 20M and 60M). The public data set (1M - 60M) is available for download at http://epp.eurostat.ec.europa.eu/portal/page/portal/gisco_Geographical_information_maps/popups/references/administrative_units_statistical_units_1 The full data set (100K - 60M) is available to EEA due to EEA having a valid EBM v5.0 licence.    These metadata are derived from the original metadata records available at Inspire@EC.","The dataset is based on the geometry from EBM v5.0. of EuroGeographics for the members of Eurogeographics, the Global Administrative Units Layer (2008) from FAO (UN) and geometry from the Turkish National Statistical Office. This resulted in a common repository of geometry of which the different datasets were derived. The different scale levels were derived of generalisations of the common repository on 100K scale. This means that within each scale level the feature classes of all these datasets: COMM_2010, NUTS_2010, CNTR_2010, EEZ_2010 and COAS_2010, are fully coherent and compliant. Each scale level in the CNTR_2010 dataset consists of 2 feature classes (regions and boundaries) The boundaries and regions are related to each other through a relationship table. In addition to the region and boundary feature classes there is also 1 label feature class which is scale independent. For each CNTR in the region feature class there is exactly 1 label. Further information on the validity and lineage is available in the database manual on the INSPIRE@EC group on CIRCABC. https://circabc.europa.eu/w/browse/bf8ae55b-a09b-4f24-a0b8-1f5784e0080c","urn:ogc:def:crs:OGP Surveying & Positioning Committee::urn:ogc:def:crs:EPSG:7.1:4258","","","","","","","",Administrative units,administrative boundary,boundaries]
"32db18e1-f82e-4037-a157-76cef6f3a8a5","eng","2012-01-23T13:27:13","Urban Atlas - United Kingdom - Exeter","","The Urban Atlas is providing pan-European comparable land use and land cover data for Large Urban Zones with more than 100.000 inhabitants as defined by the Urban Audit. Urban Atlas' mission is to provide high-resolution hotspot mapping of changes in urban spaces and indicators for users such as city governments, the European Environment Agency (EEA) and European Commission departments.","Earth Observation (EO) Data used:                       * Spot 5 2,50 m - 50262471003081143492B0 (PS) (Date: 2010/03/08)                        * Spot 5 2,50 m - 50262471003081143492B4 (PS) (Date: 2010/03/08)                        * ALOS 10 m - AL_AV2_X_20080903_111942_DLR_13907_PRUTM (XS) (Date: 2008/09/03)                        * ALOS 2,50 m - AL_PSM_P_20090421_112305_DLR_17262_PRUTM (P) (Date: 2009/04/21)                        * RapidEye 5 m - 2010-06-03T121641_RE3_3A-NAC_6218829_110466 (XS) (Date: 2010/06/03)                        * RapidEye 5 m - 2010-06-03T121643_RE3_3A-NAC_6218824_110466 (XS) (Date: 2010/06/03)                        * RapidEye 5 m - 2010-06-03T121644_RE3_3A-NAC_6218834_110466 (XS) (Date: 2010/06/03)                        * RapidEye 5 m - 2010-06-03T121645_RE3_3A-NAC_6218773_110466 (XS) (Date: 2010/06/03)                        * RapidEye 5 m - 2010-06-03T121646_RE3_3A-NAC_6218825_110466 (XS) (Date: 2010/06/03)                        * RapidEye 5 m - 2010-06-03T121648_RE3_3A-NAC_6218833_110466 (XS) (Date: 2010/06/03)                        * RapidEye 5 m - 2010-06-03T121648_RE3_3A-NAC_6218827_110466 (XS) (Date: 2010/06/03)                        * RapidEye 5 m - 2010-06-03T121649_RE3_3A-NAC_6218832_110466 (XS) (Date: 2010/06/03)                        * RapidEye 5 m - 2010-06-03T121652_RE3_3A-NAC_6218831_110466 (XS) (Date: 2010/06/03)                        * RapidEye 5 m - 2010-06-23T121556_RE4_3A-NAC_6219129_110466 (XS) (Date: 2010/06/23)                        * RapidEye 5 m - 2010-06-23T121557_RE4_3A-NAC_6219126_110466 (XS) (Date: 2010/06/23)                        * RapidEye 5 m - 2010-06-23T121600_RE4_3A-NAC_6219130_110466 (XS) (Date: 2010/06/23)                        * RapidEye 5 m - 2010-06-23T121607_RE4_3A-NAC_6219127_110466 (XS) (Date: 2010/06/23)","urn:ogc:def:crs:OGP Surveying & Positioning Committee::urn:ogc:def:crs:EPSG:7.1:32630","","","http://www.eea.europa.eu/data-and-maps/data/ds_resolveuid/9df69b925454fd267512ea65898dbbdc","","","","",Land use,urban area,land use,United Kingdom,Exeter,society]
