ID,language,date,title,abstract,description,source,crs,lowerCorner,upperCorner,link,download,thumbnail,large_thumbnail,protocol,subject
"a502f9eb-6efc-4624-b83e-a2ba815bfc4d","eng","2012-01-23T13:27:13","Urban Atlas - France - Ajaccio","","The Urban Atlas is providing pan-European comparable land use and land cover data for Large Urban Zones with more than 100.000 inhabitants as defined by the Urban Audit. Urban Atlas' mission is to provide high-resolution hotspot mapping of changes in urban spaces and indicators for users such as city governments, the European Environment Agency (EEA) and European Commission departments.","Earth Observation (EO) Data used:                       * Spot 5 2,50 m - 50582650510271039561B3 (P) (Date: 2005/10/27)                        * ALOS 10 m - AL_AV2_X_20070816_102435_DLR_8305_PREU (XS) (Date: 2007/08/16)                        * ALOS 10 m - AL_AV2_X_20070816_102443_DLR_8305_PREU (XS) (Date: 2007/08/16)                        * ALOS2,50 m - AL_PSM_P_20070614_102233_DLR_7386_PREU (P) (Date: 2007/06/14)                        * ALOS2,50 m - AL_PSM_P_20080616_101921_DLR_12754_PREU (P) (Date: 2007/08/16)                        * ALOS2,50 m - AL_PSM_P_20080616_101925_DLR_12754_PREU (P) (Date: 2007/08/16)                        * ALOS2,50 m - AL_PSM_P_20080703_102117_DLR_13002_PREU (P) (Date: 2008/07/03)","urn:ogc:def:crs:OGP Surveying & Positioning Committee::urn:ogc:def:crs:EPSG:7.1:32632","","","http://www.eea.europa.eu/data-and-maps/data/ds_resolveuid/9df69b925454fd267512ea65898dbbdc","","","","",Land use,urban area,land use,France,Ajaccio,society]
"e014f1a0-9cdf-409e-8856-018f4a6b4cb5","eng","2012-01-23T13:27:13","Urban Atlas - Italy - Rome (Roma)","","The Urban Atlas is providing pan-European comparable land use and land cover data for Large Urban Zones with more than 100.000 inhabitants as defined by the Urban Audit. Urban Atlas' mission is to provide high-resolution hotspot mapping of changes in urban spaces and indicators for users such as city governments, the European Environment Agency (EEA) and European Commission departments.","Earth Observation (EO) Data used:                       * Spot 5 2,50 m - 00182767001 (PS) (Date: 2005/04/26)                        * Spot 5 2,50 m - 00182767002 (PS) (Date: 2005/07/23)                        * Spot 5 2,50 m - 00182767003 (PS) (Date: 2005/07/24)                        * Spot 5 2,50 m - 00182767004 (PS) (Date: 2005/08/28)                        * Spot 5 2,50 m - 00182767005 (PS) (Date: 2005/08/30)","urn:ogc:def:crs:OGP Surveying & Positioning Committee::urn:ogc:def:crs:EPSG:7.1:32632","","","http://www.eea.europa.eu/data-and-maps/data/ds_resolveuid/9df69b925454fd267512ea65898dbbdc","","","","",Land use,urban area,land use,Italy,Rome,society]
"7584d10d-cd34-4fc5-9da8-a891885c3771","eng","2012-01-23T13:27:13","Urban Atlas - Czech Republic - Zlín","","The Urban Atlas is providing pan-European comparable land use and land cover data for Large Urban Zones with more than 100.000 inhabitants as defined by the Urban Audit. Urban Atlas' mission is to provide high-resolution hotspot mapping of changes in urban spaces and indicators for users such as city governments, the European Environment Agency (EEA) and European Commission departments.","Earth Observation (EO) Data used:                       * Spot 5 2,50 m - 50712500707201000211B4 (PS) (Date: 2007/07/20)","urn:ogc:def:crs:OGP Surveying & Positioning Committee::urn:ogc:def:crs:EPSG:7.1:32633","","","http://www.eea.europa.eu/data-and-maps/data/ds_resolveuid/9df69b925454fd267512ea65898dbbdc","","","","",Land use,urban area,land use,Czech Republic,Zlín,society]
"e20aecd3-8a23-4481-9662-73fe8e4dceaa","eng","2014-03-24T17:14:19","Urban Morphological Zones Changes between 2000 and 2006 (vector) - version 13, Apr. 2010","","Changes between UMZs in 2000 and UMZs in 2006 using CLC version 13. Most changes are Positive changes, understood as areas of urban sprawl (i.e. new UMZ areas between 2000 and 2006), while negative changes describe the reduction of a certain UMZ between 2000 and 2006 (warning: some negative changes might be due to different interpretations between 2000-2006).","Methodology description:  UMZ Changes have been calculated by unioning UMZ2000 and UMZ2006 layers and removing all areas which were UMZ in both years. The remaining polygons are considered as positive changes when they are new UMZ areas in 2006 and not in 2000 and negative changes when it was UMZ in 2000 and not in 2006.  Changes:  no changes applied  Publish status:  Ready for publish  process steps   Description:  Unioning of UMZ2000 and UMZ2006      Description:  Selection of areas being UMZ in 2000 or in 2006. Removal of areas being UMZ in both years (i.e. no changes)      Description:  Creation of the attribute  Change , which define positive changes when they are new UMZ areas in 2006 and negative changes when it was UMZ in 2000 and not in 2006.","urn:ogc:def:crs:OGP Surveying & Positioning Committee::urn:ogc:def:crs:EPSG:7.1:3035","","","","","","","",Land cover,environment,geoscientificInformation]
"4ca03c76-f9be-4886-9c96-38b309f6a11a","eng","2015-07-30T16:07:21","EUNIS habitat type G3.1b, predicted distribution of habitat suitability - version 1, Jan. 2015","","The modelled suitability for the EUNIS habitat type is an indication of where conditions are favourable for the habitat type based on sample plot data (Braun-Blanquet database) and the Maxent software package. The modelled suitability map may be used as a proxy for the geographical distribution of the habitat type. Note however that it is not representing the actual distribution of the habitat type.","The database compiled for the Braun-Blanquet project is a compilation of various national and regional vegetation databases. The maintenance of these databases is in principle in the hands of the custodians. However, before uploading the databases into Braun-Blanquet database a quality check is performed by Alterra and Masaryk University. If possible, detected errors are corrected and reported back to the data provider. For the modelling of the habitat suitability map the Maxent software is used (http://www.cs.princeton.edu/~schapire/maxent/). The grid values in the map represent the probability (ranging from 0-1) that the cell is suitable for the habitat. The grid file represents the habitat suitability of the EUNIS type. For the modelling the widely used software Maxent for maximum entropy modelling of species’ geographic distributions was used. Maxent is a general-purpose machine-learning method with a simple and precise mathematical formulation, and has a number of aspects that make it well-suited for species distribution modelling when only presence (occurrence) data but not absence data are available (Philips et al. 2006). Because EUNIS habitats have a particular species composition, they are assumed to respond to specific ecological requirements, allowing us to generate correlative estimates of geographic distributions. Modelling habitats that have been floristically defined is a well-known procedure for ecological modelling at local scales, and a promising technique to be applied also at the continental level.                  The Maxent method considers presence data (known observations of a given entity) and the so-called background data. Background data comprise a set of points used to describe the environmental variation of the study area according to the available environmental layers. It is assumed that these layers represent well the most important ecological gradients on a European scale. As layers the following environmental parameters have been used: Potential Evapotranspiration, Topsoil pH, Solar radiation, Temperature Seasonality (standard deviation *100), Mean Temperature of Wettest Quarter, Annual Precipitation, Precipitation Seasonality (Coefficient of Variation), Precipitation of Warmest Quarter & Distance to water (rivers, lakes, sea). Statistical output of the model: #Training samples: 1627 Regularized training gain: 1.2946 Unregularized training gain: 1.3737 Iterations: 500 Training AUC: 0.9028 #Test samples: 180 Test gain: 1.3927 Test AUC: 0.9051 AUC Standard Deviation: 0.0058 #Background points: 11626 bio_12_etrs2_ras contribution: 14.8453 bio_15_etrs2_ras contribution: 1.027 bio_18_etrs2_ras contribution: 31.3979 bio_4_etrs2_ras contribution: 34.5811 bio_8_etrs2_ras contribution: 0.3405 dist2water1km contribution: 0.1393 pet_he_yr contribution: 15.594 soil_ph contribution: 0.0413 solar_1km contribution: 2.0337 bio_12_etrs2_ras permutation importance: 15.8003 bio_15_etrs2_ras permutation importance: 2.7581 bio_18_etrs2_ras permutation importance: 4.1195 bio_4_etrs2_ras permutation importance: 55.6989 bio_8_etrs2_ras permutation importance: 0.8212 dist2water1km permutation importance: 0.5725 pet_he_yr permutation importance: 18.211 soil_ph permutation importance: 0.1923 solar_1km permutation importance: 1.8263 Entropy: 8.0661 Prevalence (average of logistic output over background sites): 0.1329 Fixed cumulative value 1 cumulative threshold: 1 Fixed cumulative value 1 logistic threshold: 0.0387 Fixed cumulative value 1 area: 0.3896 Fixed cumulative value 1 training omission: 0.0025 Fixed cumulative value 1 test omission: 0 Fixed cumulative value 1 binomial probability: 1.40E-63 Fixed cumulative value 5 cumulative threshold: 5 Fixed cumulative value 5 logistic threshold: 0.1437 Fixed cumulative value 5 area: 0.2728 Fixed cumulative value 5 training omission: 0.016 Fixed cumulative value 5 test omission: 0.0333 Fixed cumulative value 5 binomial probability: 0.00E+00 Fixed cumulative value 10 cumulative threshold: 10 Fixed cumulative value 10 logistic threshold: 0.2555 Fixed cumulative value 10 area: 0.2165 Fixed cumulative value 10 training omission: 0.0645 Fixed cumulative value 10 test omission: 0.0722 Fixed cumulative value 10 binomial probability: 0.00E+00 Minimum training presence cumulative threshold: 0.0092 Minimum training presence logistic threshold: 0.0005 Minimum training presence area: 0.8119 Minimum training presence training omission: 0 Minimum training presence test omission: 0 Minimum training presence binomial probability: 5.31E-11 10 percentile training presence cumulative threshold: 13.6057 10 percentile training presence logistic threshold: 0.3195 10 percentile training presence area: 0.1924 10 percentile training presence training omission: 0.0996 10 percentile training presence test omission: 0.0944 10 percentile training presence binomial probability: 0.00E+00 Equal training sensitivity and specificity cumulative threshold: 19.376 Equal training sensitivity and specificity logistic threshold: 0.4008 Equal training sensitivity and specificity area: 0.1645 Equal training sensitivity and specificity training omission: 0.1647 Equal training sensitivity and specificity test omission: 0.1278 Equal training sensitivity and specificity binomial probability: 0.00E+00 Maximum training sensitivity plus specificity cumulative threshold: 8.312 Maximum training sensitivity plus specificity logistic threshold: 0.2172 Maximum training sensitivity plus specificity area: 0.2315 Maximum training sensitivity plus specificity training omission: 0.0412 Maximum training sensitivity plus specificity test omission: 0.0667 Maximum training sensitivity plus specificity binomial probability: 0.00E+00 Equal test sensitivity and specificity cumulative threshold: 21.6878 Equal test sensitivity and specificity logistic threshold: 0.425 Equal test sensitivity and specificity area: 0.1555 Equal test sensitivity and specificity training omission: 0.1961 Equal test sensitivity and specificity test omission: 0.1556 Equal test sensitivity and specificity binomial probability: 0.00E+00 Maximum test sensitivity plus specificity cumulative threshold: 17.8392 Maximum test sensitivity plus specificity logistic threshold: 0.381 Maximum test sensitivity plus specificity area: 0.171 Maximum test sensitivity plus specificity training omission: 0.1457 Maximum test sensitivity plus specificity test omission: 0.1 Maximum test sensitivity plus specificity binomial probability: 0.00E+00 Balance training omission, predicted area and threshold value cumulative threshold: 1.8658 Balance training omission, predicted area and threshold value logistic threshold: 0.0695 Balance training omission, predicted area and threshold value area: 0.3469 Balance training omission, predicted area and threshold value training omission: 0.0043 Balance training omission, predicted area and threshold value test omission: 0.0056 Balance training omission, predicted area and threshold value binomial probability: 0.00E+00 Equate entropy of thresholded and original distributions cumulative threshold: 4.9421 Equate entropy of thresholded and original distributions logistic threshold: 0.1423 Equate entropy of thresholded and original distributions area: 0.2739 Equate entropy of thresholded and original distributions training omission: 0.016 Equate entropy of thresholded and original distributions test omission: 0.0333 Equate entropy of thresholded and original distributions binomial probability: 0.00E+00","urn:ogc:def:crs:OGP Surveying & Positioning Committee::urn:ogc:def:crs:EPSG:7.1:3035","","","http://www.eea.europa.eu/data-and-maps/data/ds_resolveuid/97bc44abffd54e12998008c57209e0eb","","","","",Habitats and biotopes,forest,natural area,terrestrial ecosystem,Europe,biota]
"74421f48-e62d-411b-b01e-5466a2cb955a","eng","2014-11-20T20:47:48","CDDA polygons for public access - version 12, Oct. 2014","","Some features are missing from this dataset that should therefore not be used. An updated version has been released on 20/11/2014. +++++++++++++++++++++++++++++++++++++++++++++++++++++++++++++++++++++++   The Common Database on Designated Areas (CDDA) is more commonly known as Nationally designated areas. The inventory began in 1995 under the CORINE programme of the European Commission. It is now one of the agreed Eionet priority data flows maintained by EEA with support from the European Topic Centre on Biological Diversity. It is a result of an annual data flow through Eionet countries. The EEA publishes the data set and makes it available to the World Database of Protected Areas (WDPA). The CDDA data can also be queried online in the European Nature Information System (EUNIS).   Geographical coverage of GIS vector boundary data: Albania, Austria, Belgium, Bosnia and Herzegovina, Bulgaria, Croatia, Cyprus, Czech Republic, Denmark, Estonia, Finland, Great Britain, Greece, Ireland, France, Germany, Iceland, Italy, Kosovo under UNSC Resolution 1244/99, Latvia, Liechtenstein, Lithuania, the former Yugoslav Republic of Macedonia, the Netherlands, Norway, Poland, Portugal, Romania, Serbia, Slovakia, Slovenia, Spain, Sweden and Switzerland. EEA does not have permission to distribute some or all sites reported by Estonia, Romania and Turkey.   Copyright is to be mentioned for Estonia and Finland when re-use of the dataset includes these countries. For Estonia:  Estonian Environmental Register 25.02.2014”. For Finland:  ©Finnish Environment Institute, 2014 .","Production process of the internal version is explained in the document CDDA_version_12.pdf available together with the data set.","urn:ogc:def:crs:OGP Surveying & Positioning Committee::urn:ogc:def:crs:EPSG:7.1:3035","","","","","","","",Protected sites,Habitats and biotopes,EEA33,Albania,Bosnia and Herzegovina,the former Yugoslav Republic of Macedonia,Montenegro,Serbia,Kosovo under the UN Security Council Resolution 1244/99,natural area,natural areas protection,protected area,environment]
"f97b587f-cfa1-4340-84b3-511b5566b759","eng","2012-01-23T13:27:13","Urban Atlas - France - Orléans","","The Urban Atlas is providing pan-European comparable land use and land cover data for Large Urban Zones with more than 100.000 inhabitants as defined by the Urban Audit. Urban Atlas' mission is to provide high-resolution hotspot mapping of changes in urban spaces and indicators for users such as city governments, the European Environment Agency (EEA) and European Commission departments.","Earth Observation (EO) Data used:                       * ALOS 2,50 m - AL_AV2_X_20070311_113529_DLR_6001_PREU(XS) (Date: 2007/03/11)                        * ALOS 2,50 m - AL_AV2_X_20070311_113537_DLR_6001_PREU (XS) (Date: 2007/03/11)                        * ALOS 2,50 m - AL_PSM_P_20070327_105726_DLR_6234_PREU (P) (Date: 2007/03/27)                        * ALOS 2,50 m - AL_PSM_P_20070327_105730_DLR_6234_PREU (P) (Date: 2007/03/27)                        * ALOS 2,50 m - AL_PSM_P_20070327_105734_DLR_6234_PREU (P) (Date: 2007/03/27)                        * ALOS 2,50 m - AL_PSM_P_20080514_105420_DLR_12273_PREU (P) (Date: 2008/05/14)                        * ALOS 2,50 m - AL_PSM_P_20080514_105425_DLR_12273_PREU (P) (Date: 2008/05/14)                        * ALOS 2,50 m - AL_PSM_P_20080716_105606_DLR_13192_PREU (P) (Date: 2008/07/16)                        * ALOS 2,50 m - AL_PSM_P_20080716_105610_DLR_13192_PREU (P) (Date: 2008/07/16)                        * ALOS 2,50 m - AL_PSM_P_20090303_105953_DLR_16547_PREU (P) (Date: 2009/03/03)                        * ALOS 2,50 m - AL_PSM_P_20090603_110035_DLR_17889_PREU (P) (Date: 2009/03/03)","urn:ogc:def:crs:OGP Surveying & Positioning Committee::urn:ogc:def:crs:EPSG:7.1:32631","","","http://www.eea.europa.eu/data-and-maps/data/ds_resolveuid/9df69b925454fd267512ea65898dbbdc","","","","",Land use,urban area,land use,France,Orléans,society]
"4974b545-a8a9-4a55-b074-dc089edb5d29","eng","2013-02-15T16:44:44","Hillshade derived from the Digital Elevation Model over Europe from the GSGRDA project (EU-DEM-PRE Hillshade, resolution 25 m)","","The EU-DEM is a Digital Surface Model (DSM) representing the first surface as illuminated by the sensors. EU-DEM covers the EEA39 countries and it has been produced by a consortium led by Indra, Intermap edited the EUDEM and AGI provided the water mask. The EU-DEM is a 3D raster dataset with elevations captured at 1 arc second postings (2.78E-4 degrees) or about every 30 meter. It is a hybrid product based on SRTM and ASTER GDEM data fused by a weighted averaging approach. Ownership of EU-DEM belongs to European Commision, DG Enterprise and Industry.   The projection onto an Inspire compliant grid of 25m resolution and the computation of a Hillshade raster derived from a slope and aspect datasets have been performed by the Joint Research Centre of the European Commission.","The Hillshade dataset has been created from the Slope and Aspect datasets derived from the EU-DEM projected to ETRS89/ETRS-LAEA.","urn:ogc:def:crs:OGP Surveying & Positioning Committee::urn:ogc:def:crs:EPSG:7.1:3035","","","","","","","",Elevation,Hydrography,Elevation,Hydrography,Mapping,Cartography,Geography,Geodesy,Photogrammetry,Radar,Remote sensing,elevation]
"ca27341a-b100-4466-92b6-ba13912c6f36f","eng","2012-01-10T14:35:55","EEA reference grid for Madeira (1km), May 2013","","The grid is based on proposal at the 1st European Workshop on Reference Grids in 2003 and later INSPIRE geographical grid systems. The sample grid available here is part of a set of three polygon grids in 1, 10 and 100 kilometres. The grids cover at least country borders and, where applicable, marine Exclusive Economic Zones v7.0, http://www.marineregions.org. Note that the extent of the grid into the marine area does not reflect the extent of the territorial waters.","The reference grids are based on ETRS89 Lambert Azimuthal Equal Area projection with parameters: latitude of origin 52°N, longitude of origin 10°E, false northing 3210000.0m, false easting 4321000.0m. Origin of the grid is calculated from 0mN 0mE of projection. The method followed the instructions for the EEA fishnet tool described in the EEA GIS guideline available from http://www.eionet.europa.eu/gis. All grids have been created using one of the two scripts available in the scripts subfolder located in the data directory. Their usage is documented in the readme.txt file available in the same subfolder.","urn:ogc:def:crs:OGP Surveying & Positioning Committee::urn:ogc:def:crs:EPSG:7.1:3035","","","http://www.eea.europa.eu/data-and-maps/data/eea-reference-grids-2","","","","",Geographical grid systems,location]
"6e8f9f86-6db9-4e9a-85a5-e3dd1f16b72d","eng","2012-01-23T13:27:13","Urban Atlas - Latvia - Liepāja","","The Urban Atlas is providing pan-European comparable land use and land cover data for Large Urban Zones with more than 100.000 inhabitants as defined by the Urban Audit. Urban Atlas' mission is to provide high-resolution hotspot mapping of changes in urban spaces and indicators for users such as city governments, the European Environment Agency (EEA) and European Commission departments.","Earth Observation (EO) Data used:                       * Spot 5 2,50 m - 00182800008 (PS) (Date: 2005/10/13)                        * Spot 5 2,50 m - 00182800030 (PS) (Date: 2007/06/02)                        * Spot 5 2,50 m - 00182767031 (PS) (Date: 2007/06/02)                        * Spot 5 2,50 m - 00182767032 (PS) (Date: 2007/07/16)","urn:ogc:def:crs:OGP Surveying & Positioning Committee::urn:ogc:def:crs:EPSG:7.1:32634","","","http://www.eea.europa.eu/data-and-maps/data/ds_resolveuid/9df69b925454fd267512ea65898dbbdc","","","","",Land use,urban area,land use,Latvia,Liepāja,society]
"71915f31-9e44-4b17-9d25-e04ed9dc49ae","eng","2012-01-23T13:27:13","Urban Atlas - France - Poitiers","","The Urban Atlas is providing pan-European comparable land use and land cover data for Large Urban Zones with more than 100.000 inhabitants as defined by the Urban Audit. Urban Atlas' mission is to provide high-resolution hotspot mapping of changes in urban spaces and indicators for users such as city governments, the European Environment Agency (EEA) and European Commission departments.","Earth Observation (EO) Data used:                       * Spot 5 2,50 m - 50372550510091125381B8 (PS) (Date: 2005/10/09)                        * Spot 5 2,50 m - 50382560509191110421B1 (PS) (Date: 2005/09/19)","urn:ogc:def:crs:OGP Surveying & Positioning Committee::urn:ogc:def:crs:EPSG:7.1:32631","","","http://www.eea.europa.eu/data-and-maps/data/ds_resolveuid/9df69b925454fd267512ea65898dbbdc","","","","",Land use,urban area,land use,France,Poitiers,society]
"2b6f428c-c39a-4301-9bd3-667e16ae5284","eng","2012-01-31T15:44:25","Urban Atlas - Spain - Oviedo","","The Urban Atlas is providing pan-European comparable land use and land cover data for Large Urban Zones with more than 100.000 inhabitants as defined by the Urban Audit. Urban Atlas' mission is to provide high-resolution hotspot mapping of changes in urban spaces and indicators for users such as city governments, the European Environment Agency (EEA) and European Commission departments.","Earth Observation (EO) Data used:                       * Spot 5 2,50 m - 50272630610281142251B0 (PS) (Date: 2006/10/28)                        * Spot 5 2,50 m - 50282620709051138341B6 (PS) (Date: 2007/09/05)","urn:ogc:def:crs:OGP Surveying & Positioning Committee::urn:ogc:def:crs:EPSG:7.1:32629","","","http://www.eea.europa.eu/data-and-maps/data/ds_resolveuid/9df69b925454fd267512ea65898dbbdc","","","","",Land use,urban area,land use,Spain,Oviedo,society]
"871dce9f-5082-4d4a-b130-b58e20769449","eng","2012-01-10T14:34:57","High Nature Value Farmland - Important Bird Areas","","The grid contains the reselection of CLC2000 classes in selected Important Bird Areas (resolution 100 m)","Check .pdf document","urn:ogc:def:crs:OGP Surveying & Positioning Committee::urn:ogc:def:crs:EPSG:7.1:3035","","","","","","","",Land cover,environment,geoscientificInformation]
