ID,language,date,title,abstract,description,source,crs,lowerCorner,upperCorner,link,download,thumbnail,large_thumbnail,protocol,subject
"227bba8d-ae07-49ec-8600-bc93c1d8d9d1","eng","2013-04-23T17:36:46","WISE GWB provisional dataset for horizon 1 - PUBLIC VERSION, Oct. 2012","","The shape file GWB_horizon_h1 comprises Ground Water Bodies of all countries but Estonia (all GWBs in horizon 0) and the United Kingdom, which are located in the usually uppermost horizon 1. 			 The dbf tables of the shape files include the columns “EU_CD_GW” as the GWB identifier and “Horizon” describing the vertical positioning. The polygon identifier “Polygon_ID” was added subsequently, because some GWBs consist of several polygons with identical “EU_CD_GW”even in the same horizon. Some further GWB characteristics are provided with the Microsoft Excel file “GWB_attributes_2012June.xls” including the column “EU_CD_GW”, which serves as a key for joining spatial and attribute data. There is no corresponding spatial data for GWBs in the Microsoft Excel table without an entry in column “EU_CD_GW”.  The spatial resolution is given for about a half of the GWBs in the column “Scale” of the xls file, which is varying between the MS from 1:10,000 to 1:1,000,000 and mostly in the range from 1:50,000 to 1:250,000.","All GWBs assigned to horizon 1 are collected in the shape GWB_horizon_h1 regardless the structure of the shape files submitted by the MS with affiliation to horizons, River Basin Districts or both. The attribute table includes the fields “EU_CD_GW”, “Horizon” and the artificial polygon identifier “Polygon_ID”. The linking between the shape file and the Microsoft Excel table GWB_attributes_2012June.xls, which comprises further attributes, has to be carried out using the column EU_CD_GW as key for joining the dbf table of the shape file with the xls file.  Due to licensing restrictions, UK data have been removed.","urn:ogc:def:crs:OGP Surveying & Positioning Committee::urn:ogc:def:crs:EPSG:7.1:4258","","","http://www.eea.europa.eu/data-and-maps/data/ds_resolveuid/28ab5e4028384e1484b6211d97c0f01d","","","","",Hydrography,Area management/restriction/regulation zones and reporting units,groundwater,aquifer,inlandWaters]
"5de11c72-9296-429a-aa0f-2dbc58112ab0","eng","2012-01-23T13:27:13","Urban Atlas - United Kingdom - London","","The Urban Atlas is providing pan-European comparable land use and land cover data for Large Urban Zones with more than 100.000 inhabitants as defined by the Urban Audit. Urban Atlas' mission is to provide high-resolution hotspot mapping of changes in urban spaces and indicators for users such as city governments, the European Environment Agency (EEA) and European Commission departments.","Earth Observation (EO) Data used:                       * Spot 5 2,50 m - 50302450611191116381B0 (PS) (Date: 2006/11/19)                        * Spot 5 2,50 m - 50302460611191116471B0 (PS) (Date: 2006/11/19)                        * Spot 5 2,50 m - 50322460611091109051B0 (PS) (Date: 2006/11/09)                        * Spot 5 2,50 m - 50332440611091108491B0 (PS) (Date: 2006/11/09)                        * Spot 5 2,50 m - 50332450611091108571B0 (PS) (Date: 2006/11/09)                        * Spot 5 2,50 m - 50342450910151110342B0 (PS) (Date: 2009/10/15)                        * Spot 5 2,50 m - 50342450910151110342B6 (PS) (Date: 2009/10/15)                        * Spot 5 2,50 m - 50342460909251054512B5 (PS) (Date: 2009/09/25)                        * Spot 5 2,50 m - 50352460805071122122B5 (PS) (Date: 2008/05/07)                        * Spot 5 2,50 m - 50302450611191116381B0 (PS) (Date: 2006/11/19)                        * Spot 5 2,50 m - 50302460611191116471B0 (PS) (Date: 2006/11/19)                        * Spot 5 2,50 m - 50322460611091109051B0 (PS) (Date: 2006/11/09)                        * Spot 5 2,50 m - 50332440611091108491B0 (PS) (Date: 2006/11/09)                        * Spot 5 2,50 m - 50332450611091108571B0 (PS) (Date: 2006/11/09)                        * Spot 5 2,50 m - 50342450910151110342B0 (PS) (Date: 2009/10/15)                        * Spot 5 2,50 m - 50342450910151110342B6 (PS) (Date: 2009/10/15)                        * Spot 5 2,50 m - 50342460909251054512B5 (PS) (Date: 2009/09/25)                        * Spot 5 2,50 m - 50352460805071122122B5 (PS) (Date: 2008/05/07)","urn:ogc:def:crs:OGP Surveying & Positioning Committee::urn:ogc:def:crs:EPSG:7.1:32631","","","http://www.eea.europa.eu/data-and-maps/data/ds_resolveuid/9df69b925454fd267512ea65898dbbdc","","","","",Land use,urban area,land use,United Kingdom,London,society]
"f25f9f5c-682b-4030-9b3d-0f4842c69e9c","eng","2012-01-23T13:27:13","Urban Atlas - Portugal - Funchal","","The Urban Atlas is providing pan-European comparable land use and land cover data for Large Urban Zones with more than 100.000 inhabitants as defined by the Urban Audit. Urban Atlas' mission is to provide high-resolution hotspot mapping of changes in urban spaces and indicators for users such as city governments, the European Environment Agency (EEA) and European Commission departments.","Earth Observation (EO) Data used:                       * Spot 5 2,50 m - 06JUL22121049-M1BS-052239075060_01_P006 (PS) (Date: 2006/07/22)                        * Spot 5 2,50 m - 06OCT20121343-M1BS-052239075060_01_P002 (PS) (Date: 2006/10/20)                        * Spot 5 2,50 m - 06OCT20121346-M1BS-052239075060_01_P003 (PS) (Date: 2006/10/20)                        * Spot 5 2,50 m - 06OCT25121904-M1BS-052239075060_01_P001 (PS) (Date: 2006/10/25)                        * Spot 5 2,50 m - 08JAN21121253-M1BS-052239075060_01_P004 (PS) (Date: 2008/01/21)                        * Spot 5 2,50 m - 08JAN21121257-M1BS-052239075060_01_P005 (PS) (Date: 2008/01/21)                        * RapidEye - 2009-12-13T125252_RE1_3A-NAC_5455910_104088 (XS) (Date: 2009/12/13)                        * RapidEye - 2009-12-13T125252_RE1_3A-NAC_5455911_104088 (XS) (Date: 2009/12/13)                        * RapidEye - 2009-12-13T125255_RE1_3A-NAC_5455912_104088 (XS) (Date: 2009/12/13)                        * RapidEye - 2009-12-13T125256_RE1_3A-NAC_5455909_104088 (XS) (Date: 2009/12/13)","urn:ogc:def:crs:OGP Surveying & Positioning Committee::urn:ogc:def:crs:EPSG:7.1:32628","","","http://www.eea.europa.eu/data-and-maps/data/ds_resolveuid/9df69b925454fd267512ea65898dbbdc","","","","",Land use,urban area,land use,Portugal,Funchal,society]
"d825233a-ce68-476e-b0d6-3229b89e40b0f","eng","2012-01-10T14:35:32","EEA reference grid for Ireland (10km), May 2013","","The grid is based on proposal at the 1st European Workshop on Reference Grids in 2003 and later INSPIRE geographical grid systems. The sample grid available here is part of a set of three polygon grids in 1, 10 and 100 kilometres. The grids cover at least country borders and, where applicable, marine Exclusive Economic Zones v7.0, http://www.marineregions.org. Note that the extent of the grid into the marine area does not reflect the extent of the territorial waters.","The reference grids are based on ETRS89 Lambert Azimuthal Equal Area projection with parameters: latitude of origin 52°N, longitude of origin 10°E, false northing 3210000.0m, false easting 4321000.0m. Origin of the grid is calculated from 0mN 0mE of projection. The method followed the instructions for the EEA fishnet tool described in the EEA GIS guideline available from http://www.eionet.europa.eu/gis. All grids have been created using one of the two scripts available in the scripts subfolder located in the data directory. Their usage is documented in the readme.txt file available in the same subfolder.","urn:ogc:def:crs:OGP Surveying & Positioning Committee::urn:ogc:def:crs:EPSG:7.1:3035","","","http://www.eea.europa.eu/data-and-maps/data/eea-reference-grids-2","","","","",Geographical grid systems,location]
"22c84aa8-5a03-4c7f-ba1c-1b8d17df70ad","eng","2012-01-23T13:27:13","Urban Atlas - Italy - Ancona","","The Urban Atlas is providing pan-European comparable land use and land cover data for Large Urban Zones with more than 100.000 inhabitants as defined by the Urban Audit. Urban Atlas' mission is to provide high-resolution hotspot mapping of changes in urban spaces and indicators for users such as city governments, the European Environment Agency (EEA) and European Commission departments.","Earth Observation (EO) Data used:                       * ALOS 2,50 m - AL_AV2_X_20080705_100339_DLR_13031_PRUTM (XS) (Date: 2008/07/05)                        * ALOS 2,50 m - AL_PSM_P_20080218_100529_DLR_11018_PRUTM (P) (Date: 2008/02/18)                        * ALOS 2,50 m - AL_PSM_P_20080218_100533_DLR_11018_PRUTM (P) (Date: 2008/02/18)                        * ALOS 2,50 m - AL_PSM_P_20080705_100339_DLR_13031_PRUTM (P) (Date: 2008/07/05)                        * ALOS 2,50 m - AL_PSM_P_20080705_100343_DLR_13031_PRUTM (P) (Date: 2008/07/05)","urn:ogc:def:crs:OGP Surveying & Positioning Committee::urn:ogc:def:crs:EPSG:7.1:32633","","","http://www.eea.europa.eu/data-and-maps/data/ds_resolveuid/9df69b925454fd267512ea65898dbbdc","","","","",Land use,urban area,land use,Italy,Ancona,society]
"f5021f30-43d5-455e-b938-16732796fb90","eng","2012-01-23T13:27:13","Urban Atlas - France - Nice","","The Urban Atlas is providing pan-European comparable land use and land cover data for Large Urban Zones with more than 100.000 inhabitants as defined by the Urban Audit. Urban Atlas' mission is to provide high-resolution hotspot mapping of changes in urban spaces and indicators for users such as city governments, the European Environment Agency (EEA) and European Commission departments.","Earth Observation (EO) Data used:                       * ALOS 2,50 m - AL_AV2_X_20080328_101546_DLR_11587_PREU (XS) (Date: 2008/03/28)                        * ALOS 2,50 m - AL_PSM_P_20070422_103256_DLR_6613_PREU (P) (Date: 2007/04/22)                        * ALOS 2,50 m - AL_PSM_P_20070422_103252_DLR_6613_PREU (P) (Date: 2007/04/22)                        * ALOS 2,50 m - AL_PSM_P_20080424_103010_DLR_11981_PREU (P) (Date: 2008/04/24)","urn:ogc:def:crs:OGP Surveying & Positioning Committee::urn:ogc:def:crs:EPSG:7.1:32632","","","http://www.eea.europa.eu/data-and-maps/data/ds_resolveuid/9df69b925454fd267512ea65898dbbdc","","","","",Land use,urban area,land use,France,Nice,society]
"c95d15fb-d98c-4972-a9f0-d54742ffcf71","eng","2012-01-10T14:36:03","EEA reference grid for Lithuania (1km), May 2011","","The grid is based on proposal at the 1st European Workshop on Reference Grids in 2003 and later INSPIRE geographical grid systems. The sample grid available here is part of a set of three polygon grids in 1, 10 and 100 kilometres. The grids cover at least country borders and, where applicable, marine Exclusive Economic Zones v2.0, http://www.vliz.be/vmdcdata/marbound. Note that the extent of the grid into the marine area does not reflect the extent of the territorial waters.","The reference grids are based on ETRS89 Lambert Azimuthal Equal Area projection with parameters: latitude of origin 52°N, longitude of origin 10°E, false northing 3210000.0m, false easting 4321000.0m. Origin of the grid is calculated from 0mN 0mE of projection. The method followed the instructions for the EEA fishnet tool described in the EEA GIS guideline available from http://www.eionet.europa.eu/gis.","urn:ogc:def:crs:OGP Surveying & Positioning Committee::urn:ogc:def:crs:EPSG:7.1:3035","","","http://www.eea.europa.eu/data-and-maps/data/ds_resolveuid/035b0873a523d5003396e1a02c405361","","","","",Geographical grid systems,location,geoscientificInformation]
"e834751f-19d1-4842-823d-e90e600c5993","eng","2013-05-23T16:17:00","EEA reference grid for Europe (10km) [Grid_ETRS89-LAEA_10K], May 2011","","The grid is based on proposal at the 1st European Workshop on Reference Grids in 2003 and later INSPIRE geographical grid systems.","The reference grids are based on ETRS89 Lambert Azimuthal Equal Area projection with parameters: latitude of origin 52°N, longitude of origin 10°E, false northing 3210000.0m, false easting 4321000.0m. Origin of the grid is calculated from 0mN 0mE of projection. The method followed the instructions for the EEA fishnet tool described in the EEA GIS guideline available from http://www.eionet.europa.eu/gis.","urn:ogc:def:crs:OGP Surveying & Positioning Committee::urn:ogc:def:crs:EPSG:7.1:3035","","","http://www.eea.europa.eu/data-and-maps/data/ds_resolveuid/035b0873a523d5003396e1a02c405361","","","","",Geographical grid systems,location,geoscientificInformation]
"e70ca0e1-8fd4-494a-a86b-6222bdfc82b3","eng","2012-06-06T14:27:55","Corine Land Cover 2000 (raster 250m) - version 15, Aug. 2011","","With the help of CLC data it is possible to provide support for protecting ecosystems, halting the loss of biological diversity, tracking the impacts of climate change, assessing developments in agriculture and implementing the EU Water Framework Directive. CLC data is an important data set for the implementation of key priority areas of the Sixth Environment Action Programme of the European Community. CLC data can show, for instance, where fragmentation of the landscape by roads and other infrastructure is worsening and thus increasing the risk that ecosystems can no longer connect with each other, putting the survival of their flora and fauna in danger. In the agricultural field CLC data can highlight where major structural changes are continuing or intensifying, such as the conversion of pasture to arable land, expansion or reduction in the area of fallow land and land taken out of production ('set aside'), or the abandonment of farming altogether. CLC serve as input to the EC 'Inspire' (INfrastructure for SPatial InfoRmation in Europe - http://inspire.jrc.it) initiative. This initiative intends to trigger the creation of a European spatial information infrastructure that delivers to the users integrated spatial information services. CLC programme is also a contribution to the Global Monitoring for Environment and Security (GMES http://gmes.info) initiative, run by the European Commission and the European Space Agency, to provide environmental information from a combination of air- and space-based observation systems and in-situ monitoring.","Product is based on CLC databases provided by National Teams within CLC mapping related projects (I&CLC2000, CARDS, FTSP/CLC2006 update etc.. All features in original vector database were classified and digitised based on satellite images with 100 m positional accuracy (according to CLC specifications) and 25 ha minimum mapping unit (5ha MMU for changes) into the standardized CLC nomenclature (44 CLC classes). LCEUGRIDS represent the final product of European CLC data integration. The process of data integration started when national CLC deliveries have been accepted. Delivered national data were produced in local national systems of all participating countries. Each national Coordinate Reference System (CRS) definition had to be known precisely together with its geometric relationship to a standard system in order to accurately transfer all national data into a standard coordinate reference (LAEA5210/ETRS89) for European wide geographic data. Mostly, the process itself was carried out by global equation-based transformation to ETRS89 (e.g. seven-parameters Bursa-Wolf methods). The accuracy of a particular transformation ranges from centimetres to meters depending on the method and the quality and number of control points available to define the transformation parameters, but, in any case, the accuracy is far above the actual CLC2000 data resolution (for more details see DBTA reports for particular country). Due to large data volume, national data, when transformed into the common European reference, are rasterized. The resolution of the data is 100 x 100 and 250 x 250 metres (change grids 100 x 100 metres).","urn:ogc:def:crs:OGP Surveying & Positioning Committee::urn:ogc:def:crs:EPSG:7.1:3035","","","http://www.eea.europa.eu/data-and-maps/data/ds_resolveuid/8f95c8325d1c8a20c4502088e60e03c2","","","","",Land cover,environment,geoscientificInformation]
"977c9f73-f532-405a-bb4f-a44d6d28a820","eng","2013-01-30T12:24:06","Natural susceptibility to compaction for EU27, Mar. 2008","","This map shows the natural susceptibility of agricultural soils to compaction if they were to be exposed to compaction. The evaluation of the soil’s natural susceptibility is based on the creation of logical connections between relevant parameters (pedotransfer rules). The input parameters for these pedotransfer rules are taken from the attributes of the European soil database, e.g. soil properties: type, texture and water regime, depth to textural change and the limitation of the soil for agricultural use. Besides the main parameters auxiliary parameters have been used as impermeable layer, depth of an obstacle to roots, water management system, dominant and secondary land use. It was assumed that every soil, as a porous medium, could be compacted.  The map of natural soil susceptibility to compaction was created from the evaluation of selected parameters from the ESDB. The soil susceptibility to compaction was divided into 4 categories. Two additional categories represent the data concerning places where this evaluation was either not relevant or could not been provided because of lack of information. In total there are 6 categories (attribute  Evaluation  in the shapefile):      0 - no soil. This represents water bodies, glaciers and rock outcrops     1 - low susceptibility to compaction     2. - medium susceptibility to compaction     3. - high susceptibility to compaction     4. - very high susceptibility to compaction     9. - no evaluation possible. This was the case of towns including also soils, soils disturbed by man and marsh.   			This metadata record is adapted from the orginal one received from JRC.","Refer to the document documentation/Report_Map_of_Natural_Susceptibility_Soils_to_Compaction_v1.pdf","urn:ogc:def:crs:OGP Surveying & Positioning Committee::urn:ogc:def:crs:EPSG:7.1:3035","","","http://eusoils.jrc.ec.europa.eu/library/esdac/Esdac_DetailData2.cfm?id=19","","","","",Soil,soil,soil compaction,geoscientificInformation]
"7eecfa08-129e-41d1-8e4b-58a562d4f78c","eng","2012-06-06T14:53:27","Corine Land Cover 2006 seamless (vector) - series","","This series references all versions of Corine Land Cover 2006 seamless vector starting with version 13.  With the help of CLC data it is possible to provide support for protecting ecosystems, halting the loss of biological diversity, tracking the impacts of climate change, assessing developments in agriculture and implementing the EU Water Framework Directive.   CLC data is an important data set for the implementation of key priority areas of the Sixth Environment Action Programme of the European Community. CLC data can show, for instance, where fragmentation of the landscape by roads and other infrastructure is worsening and thus increasing the risk that ecosystems can no longer connect with each other, putting the survival of their flora and fauna in danger. In the agricultural field CLC data can highlight where major structural changes are continuing or intensifying, such as the conversion of pasture to arable land, expansion or reduction in the area of fallow land and land taken out of production ('set aside'), or the abandonment of farming altogether. CLC serve as input to the EC 'Inspire' (INfrastructure for SPatial InfoRmation in Europe - http://inspire.jrc.it) initiative. This initiative intends to trigger the creation of a European spatial information infrastructure that delivers to the users integrated spatial information services. CLC programme is also a contribution to the Global Monitoring for Environment and Security (GMES http://gmes.info) initiative, run by the European Commission and the European Space Agency, to provide environmental information from a combination of air- and space-based observation systems and in-situ monitoring.","Product is based on CLC databases provided by National Teams within CLC mapping related projects (I&CLC2000, CARDS, FTSP/CLC2006 update etc.. All features in original vector database were classified and digitised based on satellite images with 100 m positional accuracy (according to CLC specifications) and 25 ha minimum mapping unit (5ha MMU for changes) into the standardized CLC nomenclature (44 CLC classes). LCEUGRIDS represent the final product of European CLC data integration. The process of data integration started when national CLC deliveries have been accepted. Delivered national data were produced in local national systems of all participating countries. Each national Coordinate Reference System (CRS) definition had to be known precisely together with its geometric relationship to a standard system in order to accurately transfer all national data into a standard coordinate reference (LAEA5210/ETRS89) for European wide geographic data. Mostly, the process itself was carried out by global equation-based transformation to ETRS89 (e.g. seven-parameters Bursa-Wolf methods). The accuracy of a particular transformation ranges from centimetres to meters depending on the method and the quality and number of control points available to define the transformation parameters, but, in any case, the accuracy is far above the actual CLC2000 data resolution (for more details see DBTA reports for particular country). Due to large data volume, national data, when transformed into the common European reference, are rasterized. The resolution of the data is 100 x 100 and 250 x 250 metres (change grids 100 x 100 metres).","urn:ogc:def:crs:OGP Surveying & Positioning Committee::urn:ogc:def:crs:EPSG:7.1:3035","","","","","","","",Land cover,environment,geoscientificInformation]
"f3da37b9-4635-406b-bbca-08e128f0aed5","eng","2012-06-06T14:41:23","Corine Land Cover 2006 (raster 100m) - version 16, Apr. 2012","","With the help of CLC data it is possible to provide support for protecting ecosystems, halting the loss of biological diversity, tracking the impacts of climate change, assessing developments in agriculture and implementing the EU Water Framework Directive. CLC data is an important data set for the implementation of key priority areas of the Sixth Environment Action Programme of the European Community. CLC data can show, for instance, where fragmentation of the landscape by roads and other infrastructure is worsening and thus increasing the risk that ecosystems can no longer connect with each other, putting the survival of their flora and fauna in danger. In the agricultural field CLC data can highlight where major structural changes are continuing or intensifying, such as the conversion of pasture to arable land, expansion or reduction in the area of fallow land and land taken out of production ('set aside'), or the abandonment of farming altogether. CLC serve as input to the EC 'Inspire' (INfrastructure for SPatial InfoRmation in Europe - http://inspire.jrc.it) initiative. This initiative intends to trigger the creation of a European spatial information infrastructure that delivers to the users integrated spatial information services. CLC programme is also a contribution to the Global Monitoring for Environment and Security (GMES http://gmes.info) initiative, run by the European Commission and the European Space Agency, to provide environmental information from a combination of air- and space-based observation systems and in-situ monitoring.","Input data: Corine Land Cover 2006 vector v16 (file geodatabase v10)  Rasterisation using gdal_rasterize from GDAL 1.9.0 command line utilities - Loop through the list of layers, and generate the layers as defined there, see the shell script [0] and the list of layers (layer_code.list) [1].  - Thereby translating the 3-digit CLC codes (111...999) into grid codes within the 8-bit  range (0...44), see clc_legend.csv [2] - And eventually adding the usual CLC colour table to the generated GeoTIFF, by using a pre-defined vrt file, see [3]  [0]: docs/rasterize.sh [1]: docs/layer_code.list [2]: docs/clc_legend.csv [3]: docs/legend_100.vrt","urn:ogc:def:crs:OGP Surveying & Positioning Committee::urn:ogc:def:crs:EPSG:7.1:3035","","","http://www.eea.europa.eu/data-and-maps/data/ds_resolveuid/ef13cef8-2ef5-49ae-9545-9042457ce4c6","","","","",Land cover,environment,geoscientificInformation]
